[I 2024-04-03 16:58:14,935] Trial 419 pruned. 
[I 2024-04-03 16:58:15,009] Trial 420 pruned. 
[I 2024-04-03 16:58:15,082] Trial 421 pruned. 
[I 2024-04-03 16:58:15,168] Trial 422 pruned. 
[I 2024-04-03 16:58:15,241] Trial 423 pruned. 
[I 2024-04-03 16:58:15,315] Trial 424 pruned. 
[I 2024-04-03 16:58:34,771] Trial 425 finished with value: 0.7957198443579766 and parameters: {'num_layers': 1, 'num_neurons': 67, 'dropout_rate': 0.11046199990051873, 'lr': 0.06204428811370553, 'optimizer': 'Adam', 'lr_decay': 0.9986579909502504}. Best is trial 44 with value: 0.8035019455252919.
[I 2024-04-03 16:58:34,844] Trial 426 pruned. 
[I 2024-04-03 16:58:34,917] Trial 427 pruned. 
[I 2024-04-03 16:58:34,989] Trial 428 pruned. 
[I 2024-04-03 16:58:35,063] Trial 429 pruned. 
[I 2024-04-03 16:58:35,136] Trial 430 pruned. 
[I 2024-04-03 16:58:35,209] Trial 431 pruned. 
[I 2024-04-03 16:58:35,330] Trial 432 pruned. 
[I 2024-04-03 16:58:35,398] Trial 433 pruned. 
[I 2024-04-03 16:58:35,471] Trial 434 pruned. 
[I 2024-04-03 16:58:35,544] Trial 435 pruned. 
[I 2024-04-03 16:58:55,139] Trial 436 finished with value: 0.7957198443579766 and parameters: {'num_layers': 1, 'num_neurons': 79, 'dropout_rate': 0.1211965895549817, 'lr': 0.04938877979450226, 'optimizer': 'Adam', 'lr_decay': 0.9991339512598578}. Best is trial 44 with value: 0.8035019455252919.
[I 2024-04-03 16:58:55,212] Trial 437 pruned. 
[I 2024-04-03 16:58:55,287] Trial 438 pruned. 
[I 2024-04-03 16:58:55,360] Trial 439 pruned. 
[I 2024-04-03 16:59:13,637] Trial 440 finished with value: 0.7996108949416343 and parameters: {'num_layers': 1, 'num_neurons': 141, 'dropout_rate': 0.11165039006252264, 'lr': 0.035553168678354376, 'optimizer': 'RMSprop', 'lr_decay': 0.9999274890424938}. Best is trial 44 with value: 0.8035019455252919.
[I 2024-04-03 16:59:13,707] Trial 441 pruned. 
[I 2024-04-03 16:59:13,782] Trial 442 pruned. 
[I 2024-04-03 16:59:13,853] Trial 443 pruned. 
[I 2024-04-03 16:59:13,924] Trial 444 pruned. 
[I 2024-04-03 16:59:13,996] Trial 445 pruned. 
[I 2024-04-03 16:59:32,438] Trial 446 finished with value: 0.7898832684824902 and parameters: {'num_layers': 1, 'num_neurons': 171, 'dropout_rate': 0.11790241266500741, 'lr': 0.06396582578025557, 'optimizer': 'RMSprop', 'lr_decay': 0.9979535394530294}. Best is trial 44 with value: 0.8035019455252919.
[I 2024-04-03 16:59:32,511] Trial 447 pruned. 
[I 2024-04-03 16:59:32,582] Trial 448 pruned. 
[I 2024-04-03 16:59:32,654] Trial 449 pruned. 
[I 2024-04-03 16:59:50,934] Trial 450 finished with value: 0.8015564202334631 and parameters: {'num_layers': 1, 'num_neurons': 134, 'dropout_rate': 0.1110362421224411, 'lr': 0.064399833613929, 'optimizer': 'RMSprop', 'lr_decay': 0.9988670386333555}. Best is trial 44 with value: 0.8035019455252919.
[I 2024-04-03 16:59:51,007] Trial 451 pruned. 
[I 2024-04-03 16:59:51,079] Trial 452 pruned. 
[I 2024-04-03 16:59:51,149] Trial 453 pruned. 
[I 2024-04-03 16:59:51,221] Trial 454 pruned. 
[I 2024-04-03 16:59:51,303] Trial 455 pruned. 
[I 2024-04-03 16:59:51,374] Trial 456 pruned. 
[I 2024-04-03 16:59:51,444] Trial 457 pruned. 
[I 2024-04-03 16:59:51,515] Trial 458 pruned. 
[I 2024-04-03 16:59:51,587] Trial 459 pruned. 
[I 2024-04-03 16:59:51,658] Trial 460 pruned. 
[I 2024-04-03 16:59:51,727] Trial 461 pruned. 
[I 2024-04-03 16:59:51,801] Trial 462 pruned. 
[I 2024-04-03 16:59:51,876] Trial 463 pruned. 
[I 2024-04-03 17:00:11,769] Trial 464 finished with value: 0.7957198443579766 and parameters: {'num_layers': 1, 'num_neurons': 115, 'dropout_rate': 0.10055760816787326, 'lr': 0.07132024499970092, 'optimizer': 'Adam', 'lr_decay': 0.9989547932000081}. Best is trial 44 with value: 0.8035019455252919.
[I 2024-04-03 17:00:31,229] Trial 465 pruned. 
[I 2024-04-03 17:00:31,305] Trial 466 pruned. 
[I 2024-04-03 17:00:31,380] Trial 467 pruned. 
[I 2024-04-03 17:00:31,455] Trial 468 pruned. 
[I 2024-04-03 17:00:31,567] Trial 469 pruned. 
[I 2024-04-03 17:00:31,642] Trial 470 pruned. 
[I 2024-04-03 17:00:31,717] Trial 471 pruned. 
[I 2024-04-03 17:00:31,791] Trial 472 pruned. 
[I 2024-04-03 17:00:49,657] Trial 473 pruned. 
[I 2024-04-03 17:00:49,732] Trial 474 pruned. 
[I 2024-04-03 17:00:49,807] Trial 475 pruned. 
[I 2024-04-03 17:00:49,892] Trial 476 pruned. 
[I 2024-04-03 17:00:49,969] Trial 477 pruned. 
[I 2024-04-03 17:00:50,043] Trial 478 pruned. 
[I 2024-04-03 17:00:50,112] Trial 479 pruned. 
[I 2024-04-03 17:00:50,188] Trial 480 pruned. 
[I 2024-04-03 17:00:50,265] Trial 481 pruned. 
[I 2024-04-03 17:00:50,340] Trial 482 pruned. 
[I 2024-04-03 17:01:12,023] Trial 483 finished with value: 0.7879377431906615 and parameters: {'num_layers': 1, 'num_neurons': 427, 'dropout_rate': 0.1306146434474123, 'lr': 0.06159555320757241, 'optimizer': 'Adam', 'lr_decay': 0.9999980295040984}. Best is trial 44 with value: 0.8035019455252919.
[I 2024-04-03 17:01:12,097] Trial 484 pruned. 
[I 2024-04-03 17:01:12,173] Trial 485 pruned. 
[I 2024-04-03 17:01:12,247] Trial 486 pruned. 
[I 2024-04-03 17:01:31,923] Trial 487 finished with value: 0.7937743190661478 and parameters: {'num_layers': 1, 'num_neurons': 123, 'dropout_rate': 0.11022095363805451, 'lr': 0.035938835689777376, 'optimizer': 'Adam', 'lr_decay': 0.9957766373575193}. Best is trial 44 with value: 0.8035019455252919.
[I 2024-04-03 17:01:31,997] Trial 488 pruned. 
[I 2024-04-03 17:01:32,073] Trial 489 pruned. 
[I 2024-04-03 17:01:32,149] Trial 490 pruned. 
[I 2024-04-03 17:01:32,228] Trial 491 pruned. 
[I 2024-04-03 17:01:32,300] Trial 492 pruned. 
[I 2024-04-03 17:01:32,375] Trial 493 pruned. 
[I 2024-04-03 17:01:32,461] Trial 494 pruned. 
[I 2024-04-03 17:01:32,536] Trial 495 pruned. 
[I 2024-04-03 17:01:32,611] Trial 496 pruned. 
[I 2024-04-03 17:01:32,688] Trial 497 pruned. 
[I 2024-04-03 17:01:32,764] Trial 498 pruned. 
[I 2024-04-03 17:01:32,839] Trial 499 pruned. 
Best parameters:  {'num_layers': 1, 'num_neurons': 87, 'dropout_rate': 0.1216806310066756, 'lr': 0.0639045325287511, 'optimizer': 'Adam', 'lr_decay': 0.9997202169755388}
Best accuracy:  0.8035019455252919
Model saved to '/lyceum/jhj1g23/Deep-Learning-Learning/uav_data/WildFires/best_model.pth'
==============================================================================
Running epilogue script on rose07.

Submit time  : 2024-04-03T16:22:46
Start time   : 2024-04-03T16:22:46
End time     : 2024-04-03T17:02:19
Elapsed time : 00:39:33 (Timelimit=03:00:00)

Job ID: 5768415
Cluster: i5
User/Group: jhj1g23/fp
State: COMPLETED (exit code 0)
Nodes: 1
Cores per node: 48
CPU Utilized: 1-06:38:39
CPU Efficiency: 96.85% of 1-07:38:24 core-walltime
Job Wall-clock time: 00:39:33
Memory Utilized: 448.81 MB
Memory Efficiency: 0.00% of 16.00 B

