[I 2024-04-03 20:09:52,019] Trial 489 finished with value: 0.8054474708171206 and parameters: {'num_layers': 5, 'num_neurons': 458, 'dropout_rate': 0.1261009159992035, 'lr': 0.0005193278319581917, 'optimizer': 'Adam', 'lr_decay': 0.9999814156936735, 'activation': 'LeakyReLU'}. Best is trial 488 with value: 0.8229571984435797.
[I 2024-04-03 20:10:46,901] Trial 490 finished with value: 0.8132295719844358 and parameters: {'num_layers': 5, 'num_neurons': 445, 'dropout_rate': 0.12422448970046052, 'lr': 0.0005404457913267354, 'optimizer': 'Adam', 'lr_decay': 0.9999563157228418, 'activation': 'LeakyReLU'}. Best is trial 488 with value: 0.8229571984435797.
[I 2024-04-03 20:11:40,673] Trial 491 finished with value: 0.8035019455252919 and parameters: {'num_layers': 5, 'num_neurons': 448, 'dropout_rate': 0.12972694243971108, 'lr': 0.0005271278645023182, 'optimizer': 'Adam', 'lr_decay': 0.9992890039996838, 'activation': 'LeakyReLU'}. Best is trial 488 with value: 0.8229571984435797.
[I 2024-04-03 20:11:40,830] Trial 492 pruned. 
[I 2024-04-03 20:11:40,987] Trial 493 pruned. 
[I 2024-04-03 20:11:41,144] Trial 494 pruned. 
[I 2024-04-03 20:12:36,812] Trial 495 finished with value: 0.8132295719844358 and parameters: {'num_layers': 5, 'num_neurons': 466, 'dropout_rate': 0.1093020937060051, 'lr': 0.0006123665187881351, 'optimizer': 'Adam', 'lr_decay': 0.9999948673023052, 'activation': 'LeakyReLU'}. Best is trial 488 with value: 0.8229571984435797.
[I 2024-04-03 20:13:32,422] Trial 496 finished with value: 0.8171206225680934 and parameters: {'num_layers': 5, 'num_neurons': 459, 'dropout_rate': 0.1274152225196849, 'lr': 0.0006945622068681253, 'optimizer': 'Adam', 'lr_decay': 0.9998779049334672, 'activation': 'LeakyReLU'}. Best is trial 488 with value: 0.8229571984435797.
[I 2024-04-03 20:13:32,580] Trial 497 pruned. 
[I 2024-04-03 20:14:27,029] Trial 498 finished with value: 0.8132295719844358 and parameters: {'num_layers': 5, 'num_neurons': 425, 'dropout_rate': 0.1102558056195869, 'lr': 0.0005638375613136974, 'optimizer': 'Adam', 'lr_decay': 0.9998917571294056, 'activation': 'LeakyReLU'}. Best is trial 488 with value: 0.8229571984435797.
[I 2024-04-03 20:14:27,188] Trial 499 pruned. 
Model saved to '/lyceum/jhj1g23/Deep-Learning-Learning/uav_data/WildFires/best_model2.pth'
==============================================================================
Running epilogue script on rose02.

Submit time  : 2024-04-03T17:38:50
Start time   : 2024-04-03T17:38:51
End time     : 2024-04-03T20:16:48
Elapsed time : 02:37:57 (Timelimit=03:00:00)

Job ID: 5768521
Cluster: i5
User/Group: jhj1g23/fp
State: COMPLETED (exit code 0)
Nodes: 1
Cores per node: 48
CPU Utilized: 5-04:56:50
CPU Efficiency: 98.88% of 5-06:21:36 core-walltime
Job Wall-clock time: 02:37:57
Memory Utilized: 656.02 MB
Memory Efficiency: 0.00% of 16.00 B

