Running SLURM prolog script on rose07.cluster.local
===============================================================================
Job started on Wed Apr  3 16:22:46 BST 2024
Job ID          : 5768415
Job name        : lauch.sh
WorkDir         : /mainfs/lyceum/jhj1g23/Deep-Learning-Learning/uavsvm
Command         : /mainfs/lyceum/jhj1g23/Deep-Learning-Learning/uavsvm/lauch.sh
Partition       : a100
Num hosts       : 1
Num cores       : 48
Num of tasks    : 1
Hosts allocated : rose07
Job Output Follows ...
===============================================================================
[I 2024-04-03 16:23:30,652] A new study created in memory with name: no-name-72778400-5b50-4185-b649-e39bf601ce61
[I 2024-04-03 16:24:12,175] Trial 0 finished with value: 0.7821011673151751 and parameters: {'num_layers': 3, 'num_neurons': 95, 'dropout_rate': 0.4426259839798392, 'lr': 0.008586660464973446, 'optimizer': 'RMSprop', 'lr_decay': 0.9539742118743993}. Best is trial 0 with value: 0.7821011673151751.
[I 2024-04-03 16:24:53,505] Trial 1 finished with value: 0.7782101167315175 and parameters: {'num_layers': 4, 'num_neurons': 343, 'dropout_rate': 0.10574519793060372, 'lr': 0.03438987613575639, 'optimizer': 'RMSprop', 'lr_decay': 0.9678638589993721}. Best is trial 0 with value: 0.7821011673151751.
[I 2024-04-03 16:25:14,386] Trial 2 finished with value: 0.7762645914396887 and parameters: {'num_layers': 1, 'num_neurons': 403, 'dropout_rate': 0.563447931149026, 'lr': 0.019497501895105792, 'optimizer': 'Adam', 'lr_decay': 0.9548189775117538}. Best is trial 0 with value: 0.7821011673151751.
[I 2024-04-03 16:25:39,542] Trial 3 finished with value: 0.77431906614786 and parameters: {'num_layers': 2, 'num_neurons': 98, 'dropout_rate': 0.4780722726706492, 'lr': 0.07975088294474626, 'optimizer': 'Adam', 'lr_decay': 0.950491735826632}. Best is trial 0 with value: 0.7821011673151751.
[I 2024-04-03 16:26:05,440] Trial 4 finished with value: 0.7859922178988327 and parameters: {'num_layers': 2, 'num_neurons': 144, 'dropout_rate': 0.17815195482368523, 'lr': 0.023665121893349267, 'optimizer': 'Adam', 'lr_decay': 0.9768015423777993}. Best is trial 4 with value: 0.7859922178988327.
[I 2024-04-03 16:26:36,944] Trial 5 finished with value: 0.7840466926070039 and parameters: {'num_layers': 3, 'num_neurons': 120, 'dropout_rate': 0.39152504323634363, 'lr': 0.027048296283265494, 'optimizer': 'Adam', 'lr_decay': 0.9931026577550854}. Best is trial 4 with value: 0.7859922178988327.
[I 2024-04-03 16:26:37,017] Trial 6 pruned. 
[I 2024-04-03 16:26:37,060] Trial 7 pruned. 
[I 2024-04-03 16:27:19,331] Trial 8 finished with value: 0.7859922178988327 and parameters: {'num_layers': 4, 'num_neurons': 262, 'dropout_rate': 0.5464972268372159, 'lr': 0.0004955096610020476, 'optimizer': 'Adam', 'lr_decay': 0.9964930822838771}. Best is trial 4 with value: 0.7859922178988327.
[I 2024-04-03 16:27:19,372] Trial 9 pruned. 
[I 2024-04-03 16:27:23,328] Trial 10 pruned. 
[I 2024-04-03 16:27:23,417] Trial 11 pruned. 
[I 2024-04-03 16:27:23,517] Trial 12 pruned. 
[I 2024-04-03 16:27:25,614] Trial 13 pruned. 
[I 2024-04-03 16:27:25,711] Trial 14 pruned. 
[I 2024-04-03 16:27:28,027] Trial 15 pruned. 
[I 2024-04-03 16:27:28,123] Trial 16 pruned. 
[I 2024-04-03 16:27:28,348] Trial 17 pruned. 
[I 2024-04-03 16:27:28,408] Trial 18 pruned. 
[I 2024-04-03 16:27:32,579] Trial 19 pruned. 
[I 2024-04-03 16:28:07,676] Trial 20 finished with value: 0.7859922178988327 and parameters: {'num_layers': 3, 'num_neurons': 239, 'dropout_rate': 0.6426331532320841, 'lr': 0.009371268303670216, 'optimizer': 'Adam', 'lr_decay': 0.9943271466361631}. Best is trial 4 with value: 0.7859922178988327.
[I 2024-04-03 16:28:07,768] Trial 21 pruned. 
[I 2024-04-03 16:28:07,841] Trial 22 pruned. 
[I 2024-04-03 16:28:07,937] Trial 23 pruned. 
[I 2024-04-03 16:28:08,029] Trial 24 pruned. 
[I 2024-04-03 16:28:54,825] Trial 25 finished with value: 0.7782101167315175 and parameters: {'num_layers': 4, 'num_neurons': 377, 'dropout_rate': 0.642675162812529, 'lr': 0.00033824439328958284, 'optimizer': 'Adam', 'lr_decay': 0.9858914220353778}. Best is trial 4 with value: 0.7859922178988327.
[I 2024-04-03 16:28:54,899] Trial 26 pruned. 
[I 2024-04-03 16:28:54,989] Trial 27 pruned. 
[I 2024-04-03 16:28:55,074] Trial 28 pruned. 
[I 2024-04-03 16:28:55,318] Trial 29 pruned. 
[I 2024-04-03 16:28:55,392] Trial 30 pruned. 
[I 2024-04-03 16:28:55,475] Trial 31 pruned. 
[I 2024-04-03 16:29:21,815] Trial 32 finished with value: 0.7976653696498055 and parameters: {'num_layers': 2, 'num_neurons': 136, 'dropout_rate': 0.1186320233739073, 'lr': 0.02511164744416537, 'optimizer': 'Adam', 'lr_decay': 0.9914229910995863}. Best is trial 32 with value: 0.7976653696498055.
[I 2024-04-03 16:29:41,515] Trial 33 finished with value: 0.7879377431906615 and parameters: {'num_layers': 1, 'num_neurons': 86, 'dropout_rate': 0.10224915337911927, 'lr': 0.04275037882947505, 'optimizer': 'Adam', 'lr_decay': 0.9908285072495466}. Best is trial 32 with value: 0.7976653696498055.
[I 2024-04-03 16:30:01,193] Trial 34 finished with value: 0.7840466926070039 and parameters: {'num_layers': 1, 'num_neurons': 79, 'dropout_rate': 0.10310282737102523, 'lr': 0.04747494169506989, 'optimizer': 'Adam', 'lr_decay': 0.9904042273662707}. Best is trial 32 with value: 0.7976653696498055.
[I 2024-04-03 16:30:01,873] Trial 35 pruned. 
[I 2024-04-03 16:30:01,944] Trial 36 pruned. 
[I 2024-04-03 16:30:02,006] Trial 37 pruned. 
[I 2024-04-03 16:30:02,063] Trial 38 pruned. 
[I 2024-04-03 16:30:02,136] Trial 39 pruned. 
[I 2024-04-03 16:30:21,540] Trial 40 finished with value: 0.7879377431906615 and parameters: {'num_layers': 1, 'num_neurons': 52, 'dropout_rate': 0.19606346353840898, 'lr': 0.09933190289458242, 'optimizer': 'Adam', 'lr_decay': 0.9967891878724902}. Best is trial 32 with value: 0.7976653696498055.
[I 2024-04-03 16:30:40,991] Trial 41 finished with value: 0.7879377431906615 and parameters: {'num_layers': 1, 'num_neurons': 56, 'dropout_rate': 0.18604172526306761, 'lr': 0.05785667739923601, 'optimizer': 'Adam', 'lr_decay': 0.996478237511596}. Best is trial 32 with value: 0.7976653696498055.
[I 2024-04-03 16:31:00,558] Trial 42 finished with value: 0.7898832684824902 and parameters: {'num_layers': 1, 'num_neurons': 59, 'dropout_rate': 0.1862992417304551, 'lr': 0.09233124318449461, 'optimizer': 'Adam', 'lr_decay': 0.9977162482802533}. Best is trial 32 with value: 0.7976653696498055.
[I 2024-04-03 16:31:00,616] Trial 43 pruned. 
[I 2024-04-03 16:31:20,360] Trial 44 finished with value: 0.8035019455252919 and parameters: {'num_layers': 1, 'num_neurons': 87, 'dropout_rate': 0.1216806310066756, 'lr': 0.0639045325287511, 'optimizer': 'Adam', 'lr_decay': 0.9997202169755388}. Best is trial 44 with value: 0.8035019455252919.
[I 2024-04-03 16:31:40,166] Trial 45 finished with value: 0.7879377431906615 and parameters: {'num_layers': 1, 'num_neurons': 97, 'dropout_rate': 0.10063957472292728, 'lr': 0.07347250082829518, 'optimizer': 'Adam', 'lr_decay': 0.9998606244008927}. Best is trial 44 with value: 0.8035019455252919.
[I 2024-04-03 16:31:59,887] Trial 46 finished with value: 0.7937743190661478 and parameters: {'num_layers': 1, 'num_neurons': 85, 'dropout_rate': 0.12706712213967175, 'lr': 0.03535379443919935, 'optimizer': 'Adam', 'lr_decay': 0.9951653735617381}. Best is trial 44 with value: 0.8035019455252919.
[I 2024-04-03 16:31:59,940] Trial 47 pruned. 
[I 2024-04-03 16:32:19,683] Trial 48 finished with value: 0.7840466926070039 and parameters: {'num_layers': 1, 'num_neurons': 108, 'dropout_rate': 0.16107516556539195, 'lr': 0.017582076572259672, 'optimizer': 'Adam', 'lr_decay': 0.9945183963357106}. Best is trial 44 with value: 0.8035019455252919.
[I 2024-04-03 16:32:39,586] Trial 49 finished with value: 0.7840466926070039 and parameters: {'num_layers': 1, 'num_neurons': 129, 'dropout_rate': 0.2507688415178613, 'lr': 0.03377191236784075, 'optimizer': 'Adam', 'lr_decay': 0.988636129662016}. Best is trial 44 with value: 0.8035019455252919.
[I 2024-04-03 16:32:39,655] Trial 50 pruned. 
[I 2024-04-03 16:32:39,713] Trial 51 pruned. 
[I 2024-04-03 16:32:39,772] Trial 52 pruned. 
[I 2024-04-03 16:32:39,830] Trial 53 pruned. 
[I 2024-04-03 16:32:39,901] Trial 54 pruned. 
[I 2024-04-03 16:32:39,959] Trial 55 pruned. 
[I 2024-04-03 16:32:40,013] Trial 56 pruned. 
[I 2024-04-03 16:33:04,344] Trial 57 finished with value: 0.7879377431906615 and parameters: {'num_layers': 2, 'num_neurons': 32, 'dropout_rate': 0.1738273503856907, 'lr': 0.03232158857684427, 'optimizer': 'Adam', 'lr_decay': 0.9986129818032913}. Best is trial 44 with value: 0.8035019455252919.
[I 2024-04-03 16:33:04,400] Trial 58 pruned. 
[I 2024-04-03 16:33:04,459] Trial 59 pruned. 
[I 2024-04-03 16:33:31,140] Trial 60 finished with value: 0.7879377431906615 and parameters: {'num_layers': 2, 'num_neurons': 137, 'dropout_rate': 0.15987656418374996, 'lr': 0.01577633997590513, 'optimizer': 'Adam', 'lr_decay': 0.9892343088167699}. Best is trial 44 with value: 0.8035019455252919.
[I 2024-04-03 16:33:31,199] Trial 61 pruned. 
[I 2024-04-03 16:33:50,713] Trial 62 finished with value: 0.7937743190661478 and parameters: {'num_layers': 1, 'num_neurons': 66, 'dropout_rate': 0.11874469674484447, 'lr': 0.06883015572270017, 'optimizer': 'Adam', 'lr_decay': 0.9967751401247823}. Best is trial 44 with value: 0.8035019455252919.
[I 2024-04-03 16:33:50,772] Trial 63 pruned. 
[I 2024-04-03 16:34:10,435] Trial 64 finished with value: 0.7937743190661478 and parameters: {'num_layers': 1, 'num_neurons': 90, 'dropout_rate': 0.10042587703912717, 'lr': 0.07525576022807601, 'optimizer': 'Adam', 'lr_decay': 0.9978438031173177}. Best is trial 44 with value: 0.8035019455252919.
[I 2024-04-03 16:34:10,495] Trial 65 pruned. 
[I 2024-04-03 16:34:10,566] Trial 66 pruned. 
[I 2024-04-03 16:34:10,620] Trial 67 pruned. 
[I 2024-04-03 16:34:10,681] Trial 68 pruned. 
[I 2024-04-03 16:34:10,754] Trial 69 pruned. 
[I 2024-04-03 16:34:11,918] Trial 70 pruned. 
[I 2024-04-03 16:34:11,977] Trial 71 pruned. 
[I 2024-04-03 16:34:12,037] Trial 72 pruned. 
[I 2024-04-03 16:34:12,097] Trial 73 pruned. 
[I 2024-04-03 16:34:12,156] Trial 74 pruned. 
[I 2024-04-03 16:34:12,215] Trial 75 pruned. 
[I 2024-04-03 16:34:12,276] Trial 76 pruned. 
[I 2024-04-03 16:34:12,347] Trial 77 pruned. 
[I 2024-04-03 16:34:12,406] Trial 78 pruned. 
[I 2024-04-03 16:34:31,791] Trial 79 finished with value: 0.7937743190661478 and parameters: {'num_layers': 1, 'num_neurons': 41, 'dropout_rate': 0.10929075355399699, 'lr': 0.09949899934817322, 'optimizer': 'Adam', 'lr_decay': 0.9934234179509873}. Best is trial 44 with value: 0.8035019455252919.
[I 2024-04-03 16:34:31,843] Trial 80 pruned. 
[I 2024-04-03 16:34:51,351] Trial 81 finished with value: 0.7898832684824902 and parameters: {'num_layers': 1, 'num_neurons': 58, 'dropout_rate': 0.14870399982681803, 'lr': 0.08612833908503394, 'optimizer': 'Adam', 'lr_decay': 0.9959838355137692}. Best is trial 44 with value: 0.8035019455252919.
[I 2024-04-03 16:35:10,924] Trial 82 finished with value: 0.7859922178988327 and parameters: {'num_layers': 1, 'num_neurons': 74, 'dropout_rate': 0.1488160748610261, 'lr': 0.0542871096084764, 'optimizer': 'Adam', 'lr_decay': 0.9901209338797056}. Best is trial 44 with value: 0.8035019455252919.
[I 2024-04-03 16:35:10,984] Trial 83 pruned. 
[I 2024-04-03 16:35:30,887] Trial 84 finished with value: 0.7976653696498055 and parameters: {'num_layers': 1, 'num_neurons': 121, 'dropout_rate': 0.1322502275382026, 'lr': 0.06295385312815202, 'optimizer': 'Adam', 'lr_decay': 0.9985047087617615}. Best is trial 44 with value: 0.8035019455252919.
[I 2024-04-03 16:35:50,844] Trial 85 finished with value: 0.7996108949416343 and parameters: {'num_layers': 1, 'num_neurons': 119, 'dropout_rate': 0.13216654628703162, 'lr': 0.06157525523775862, 'optimizer': 'Adam', 'lr_decay': 0.9990145787080575}. Best is trial 44 with value: 0.8035019455252919.
[I 2024-04-03 16:35:50,906] Trial 86 pruned. 
[I 2024-04-03 16:36:10,814] Trial 87 finished with value: 0.7976653696498055 and parameters: {'num_layers': 1, 'num_neurons': 122, 'dropout_rate': 0.12695840749005663, 'lr': 0.0632089996435392, 'optimizer': 'Adam', 'lr_decay': 0.997812350279087}. Best is trial 44 with value: 0.8035019455252919.
[I 2024-04-03 16:36:10,883] Trial 88 pruned. 
[I 2024-04-03 16:36:30,858] Trial 89 finished with value: 0.7937743190661478 and parameters: {'num_layers': 1, 'num_neurons': 147, 'dropout_rate': 0.1674275391868291, 'lr': 0.032168510665138345, 'optimizer': 'Adam', 'lr_decay': 0.9992914541625727}. Best is trial 44 with value: 0.8035019455252919.
[I 2024-04-03 16:36:30,920] Trial 90 pruned. 
[I 2024-04-03 16:36:50,718] Trial 91 finished with value: 0.791828793774319 and parameters: {'num_layers': 1, 'num_neurons': 117, 'dropout_rate': 0.16848367730184982, 'lr': 0.027413566610406052, 'optimizer': 'Adam', 'lr_decay': 0.9993419161948263}. Best is trial 44 with value: 0.8035019455252919.
[I 2024-04-03 16:36:50,779] Trial 92 pruned. 
[I 2024-04-03 16:36:50,841] Trial 93 pruned. 
[I 2024-04-03 16:36:50,958] Trial 94 pruned. 
[I 2024-04-03 16:37:10,874] Trial 95 finished with value: 0.7937743190661478 and parameters: {'num_layers': 1, 'num_neurons': 108, 'dropout_rate': 0.12093765277915086, 'lr': 0.06380365391718872, 'optimizer': 'Adam', 'lr_decay': 0.9989459783945132}. Best is trial 44 with value: 0.8035019455252919.
[I 2024-04-03 16:37:10,934] Trial 96 pruned. 
[I 2024-04-03 16:37:10,996] Trial 97 pruned. 
[I 2024-04-03 16:37:30,713] Trial 98 finished with value: 0.7898832684824902 and parameters: {'num_layers': 1, 'num_neurons': 91, 'dropout_rate': 0.17289882510032348, 'lr': 0.05008376402394485, 'optimizer': 'Adam', 'lr_decay': 0.9919749600699861}. Best is trial 44 with value: 0.8035019455252919.
[I 2024-04-03 16:37:30,774] Trial 99 pruned. 
[I 2024-04-03 16:37:30,837] Trial 100 pruned. 
[I 2024-04-03 16:37:30,898] Trial 101 pruned. 
[I 2024-04-03 16:37:30,959] Trial 102 pruned. 
[I 2024-04-03 16:37:31,021] Trial 103 pruned. 
[I 2024-04-03 16:37:31,083] Trial 104 pruned. 
[I 2024-04-03 16:37:31,145] Trial 105 pruned. 
[I 2024-04-03 16:37:31,209] Trial 106 pruned. 
[I 2024-04-03 16:37:50,984] Trial 107 finished with value: 0.7898832684824902 and parameters: {'num_layers': 1, 'num_neurons': 90, 'dropout_rate': 0.10019802740695796, 'lr': 0.06306788404250481, 'optimizer': 'Adam', 'lr_decay': 0.9941856842505036}. Best is trial 44 with value: 0.8035019455252919.
[I 2024-04-03 16:38:08,955] Trial 108 finished with value: 0.7898832684824902 and parameters: {'num_layers': 1, 'num_neurons': 40, 'dropout_rate': 0.13759184787581002, 'lr': 0.04305955786867485, 'optimizer': 'RMSprop', 'lr_decay': 0.996464054360039}. Best is trial 44 with value: 0.8035019455252919.
[I 2024-04-03 16:38:09,017] Trial 109 pruned. 
[I 2024-04-03 16:38:27,454] Trial 110 pruned. 
[I 2024-04-03 16:38:47,406] Trial 111 finished with value: 0.8015564202334631 and parameters: {'num_layers': 1, 'num_neurons': 117, 'dropout_rate': 0.1820379738992909, 'lr': 0.03090190615194614, 'optimizer': 'Adam', 'lr_decay': 0.9992427174551345}. Best is trial 44 with value: 0.8035019455252919.
[I 2024-04-03 16:38:47,468] Trial 112 pruned. 
[I 2024-04-03 16:38:47,530] Trial 113 pruned. 
[I 2024-04-03 16:38:47,593] Trial 114 pruned. 
[I 2024-04-03 16:38:47,654] Trial 115 pruned. 
[I 2024-04-03 16:38:47,716] Trial 116 pruned. 
[I 2024-04-03 16:38:47,791] Trial 117 pruned. 
[I 2024-04-03 16:38:47,853] Trial 118 pruned. 
[I 2024-04-03 16:38:47,918] Trial 119 pruned. 
[I 2024-04-03 16:39:07,904] Trial 120 finished with value: 0.7840466926070039 and parameters: {'num_layers': 1, 'num_neurons': 119, 'dropout_rate': 0.16556030378290224, 'lr': 0.0637252377153603, 'optimizer': 'Adam', 'lr_decay': 0.9999079063531648}. Best is trial 44 with value: 0.8035019455252919.
[I 2024-04-03 16:39:27,855] Trial 121 finished with value: 0.7976653696498055 and parameters: {'num_layers': 1, 'num_neurons': 117, 'dropout_rate': 0.1688912292109262, 'lr': 0.02807534874499737, 'optimizer': 'Adam', 'lr_decay': 0.9992334689738444}. Best is trial 44 with value: 0.8035019455252919.
[I 2024-04-03 16:39:47,614] Trial 122 finished with value: 0.791828793774319 and parameters: {'num_layers': 1, 'num_neurons': 99, 'dropout_rate': 0.14178379711509254, 'lr': 0.02888084525375807, 'optimizer': 'Adam', 'lr_decay': 0.9966612370285792}. Best is trial 44 with value: 0.8035019455252919.
[I 2024-04-03 16:39:48,032] Trial 123 pruned. 
[I 2024-04-03 16:40:07,876] Trial 124 finished with value: 0.7937743190661478 and parameters: {'num_layers': 1, 'num_neurons': 133, 'dropout_rate': 0.12179025896636657, 'lr': 0.04184458541373265, 'optimizer': 'Adam', 'lr_decay': 0.9944652030011512}. Best is trial 44 with value: 0.8035019455252919.
[I 2024-04-03 16:40:27,536] Trial 125 finished with value: 0.7898832684824902 and parameters: {'num_layers': 1, 'num_neurons': 80, 'dropout_rate': 0.15601094770563576, 'lr': 0.053380457835116184, 'optimizer': 'Adam', 'lr_decay': 0.9999896046646359}. Best is trial 44 with value: 0.8035019455252919.
[I 2024-04-03 16:40:27,592] Trial 126 pruned. 
[I 2024-04-03 16:40:27,654] Trial 127 pruned. 
[I 2024-04-03 16:40:27,716] Trial 128 pruned. 
[I 2024-04-03 16:40:45,528] Trial 129 finished with value: 0.7898832684824902 and parameters: {'num_layers': 1, 'num_neurons': 46, 'dropout_rate': 0.42640263140153783, 'lr': 0.0666561740033525, 'optimizer': 'RMSprop', 'lr_decay': 0.9968377666993026}. Best is trial 44 with value: 0.8035019455252919.
[I 2024-04-03 16:40:45,591] Trial 130 pruned. 
[I 2024-04-03 16:41:05,568] Trial 131 finished with value: 0.791828793774319 and parameters: {'num_layers': 1, 'num_neurons': 134, 'dropout_rate': 0.1212436564638178, 'lr': 0.042648735975428786, 'optimizer': 'Adam', 'lr_decay': 0.9941872708016398}. Best is trial 44 with value: 0.8035019455252919.
[I 2024-04-03 16:41:06,710] Trial 132 pruned. 
[I 2024-04-03 16:41:07,841] Trial 133 pruned. 
[I 2024-04-03 16:41:08,974] Trial 134 pruned. 
[I 2024-04-03 16:41:09,037] Trial 135 pruned. 
[I 2024-04-03 16:41:29,015] Trial 136 finished with value: 0.7937743190661478 and parameters: {'num_layers': 1, 'num_neurons': 130, 'dropout_rate': 0.16410983313158714, 'lr': 0.09902291604990336, 'optimizer': 'Adam', 'lr_decay': 0.9961229316695426}. Best is trial 44 with value: 0.8035019455252919.
[I 2024-04-03 16:42:00,401] Trial 137 finished with value: 0.791828793774319 and parameters: {'num_layers': 3, 'num_neurons': 78, 'dropout_rate': 0.11053665665535119, 'lr': 0.07708363236190152, 'optimizer': 'Adam', 'lr_decay': 0.9975193138542848}. Best is trial 44 with value: 0.8035019455252919.
[I 2024-04-03 16:42:00,464] Trial 138 pruned. 
[I 2024-04-03 16:42:06,388] Trial 139 pruned. 
[I 2024-04-03 16:42:26,455] Trial 140 finished with value: 0.7937743190661478 and parameters: {'num_layers': 1, 'num_neurons': 138, 'dropout_rate': 0.13800406915508, 'lr': 0.035931374117843556, 'optimizer': 'Adam', 'lr_decay': 0.9993825907259611}. Best is trial 44 with value: 0.8035019455252919.
[I 2024-04-03 16:42:46,473] Trial 141 finished with value: 0.7957198443579766 and parameters: {'num_layers': 1, 'num_neurons': 126, 'dropout_rate': 0.1595318902747002, 'lr': 0.09330317495034388, 'optimizer': 'Adam', 'lr_decay': 0.9962817399531313}. Best is trial 44 with value: 0.8035019455252919.
[I 2024-04-03 16:42:46,537] Trial 142 pruned. 
[I 2024-04-03 16:42:46,602] Trial 143 pruned. 
[I 2024-04-03 16:43:06,885] Trial 144 finished with value: 0.7976653696498055 and parameters: {'num_layers': 1, 'num_neurons': 148, 'dropout_rate': 0.14779834580137943, 'lr': 0.07340957520272297, 'optimizer': 'Adam', 'lr_decay': 0.9982321866243923}. Best is trial 44 with value: 0.8035019455252919.
[I 2024-04-03 16:43:06,949] Trial 145 pruned. 
[I 2024-04-03 16:43:07,013] Trial 146 pruned. 
[I 2024-04-03 16:43:07,076] Trial 147 pruned. 
[I 2024-04-03 16:43:07,134] Trial 148 pruned. 
[I 2024-04-03 16:43:07,197] Trial 149 pruned. 
[I 2024-04-03 16:43:27,373] Trial 150 finished with value: 0.7996108949416343 and parameters: {'num_layers': 1, 'num_neurons': 178, 'dropout_rate': 0.10026228150647633, 'lr': 0.056564398715338644, 'optimizer': 'Adam', 'lr_decay': 0.9981461936346508}. Best is trial 44 with value: 0.8035019455252919.
[I 2024-04-03 16:43:27,435] Trial 151 pruned. 
[I 2024-04-03 16:43:27,499] Trial 152 pruned. 
[I 2024-04-03 16:43:27,561] Trial 153 pruned. 
[I 2024-04-03 16:43:27,625] Trial 154 pruned. 
[I 2024-04-03 16:43:27,729] Trial 155 pruned. 
[I 2024-04-03 16:43:27,792] Trial 156 pruned. 
[I 2024-04-03 16:43:47,524] Trial 157 finished with value: 0.7957198443579766 and parameters: {'num_layers': 1, 'num_neurons': 115, 'dropout_rate': 0.11172502071810901, 'lr': 0.05680173861011479, 'optimizer': 'Adam', 'lr_decay': 0.995795036619234}. Best is trial 44 with value: 0.8035019455252919.
[I 2024-04-03 16:43:47,586] Trial 158 pruned. 
[I 2024-04-03 16:44:07,357] Trial 159 finished with value: 0.7996108949416343 and parameters: {'num_layers': 1, 'num_neurons': 128, 'dropout_rate': 0.1161094312705821, 'lr': 0.09975168411441339, 'optimizer': 'Adam', 'lr_decay': 0.9967827220404558}. Best is trial 44 with value: 0.8035019455252919.
[I 2024-04-03 16:44:07,419] Trial 160 pruned. 
[I 2024-04-03 16:44:27,150] Trial 161 finished with value: 0.7898832684824902 and parameters: {'num_layers': 1, 'num_neurons': 113, 'dropout_rate': 0.131768652781934, 'lr': 0.07307526304865336, 'optimizer': 'Adam', 'lr_decay': 0.9966946596750712}. Best is trial 44 with value: 0.8035019455252919.
[I 2024-04-03 16:44:27,239] Trial 162 pruned. 
[I 2024-04-03 16:44:47,323] Trial 163 finished with value: 0.7879377431906615 and parameters: {'num_layers': 1, 'num_neurons': 159, 'dropout_rate': 0.10086002653421636, 'lr': 0.09938468054481685, 'optimizer': 'Adam', 'lr_decay': 0.9973641089939326}. Best is trial 44 with value: 0.8035019455252919.
[I 2024-04-03 16:44:47,387] Trial 164 pruned. 
