[I 2024-04-03 16:45:07,292] Trial 165 finished with value: 0.7937743190661478 and parameters: {'num_layers': 1, 'num_neurons': 121, 'dropout_rate': 0.1583205365125735, 'lr': 0.08214720037550557, 'optimizer': 'Adam', 'lr_decay': 0.9982119308080346}. Best is trial 44 with value: 0.8035019455252919.
[I 2024-04-03 16:45:07,355] Trial 166 pruned. 
[I 2024-04-03 16:45:07,418] Trial 167 pruned. 
[I 2024-04-03 16:45:07,482] Trial 168 pruned. 
[I 2024-04-03 16:45:07,597] Trial 169 pruned. 
[I 2024-04-03 16:45:07,660] Trial 170 pruned. 
[I 2024-04-03 16:45:07,725] Trial 171 pruned. 
[I 2024-04-03 16:45:07,789] Trial 172 pruned. 
[I 2024-04-03 16:45:07,852] Trial 173 pruned. 
[I 2024-04-03 16:45:07,916] Trial 174 pruned. 
[I 2024-04-03 16:45:27,601] Trial 175 finished with value: 0.7937743190661478 and parameters: {'num_layers': 1, 'num_neurons': 136, 'dropout_rate': 0.14412178850089588, 'lr': 0.05026300878573421, 'optimizer': 'Adam', 'lr_decay': 0.9959258028033354}. Best is trial 44 with value: 0.8035019455252919.
[I 2024-04-03 16:45:27,665] Trial 176 pruned. 
[I 2024-04-03 16:45:27,730] Trial 177 pruned. 
[I 2024-04-03 16:45:27,794] Trial 178 pruned. 
[I 2024-04-03 16:45:27,852] Trial 179 pruned. 
[I 2024-04-03 16:45:27,915] Trial 180 pruned. 
[I 2024-04-03 16:45:27,979] Trial 181 pruned. 
[I 2024-04-03 16:45:47,752] Trial 182 finished with value: 0.7898832684824902 and parameters: {'num_layers': 1, 'num_neurons': 131, 'dropout_rate': 0.11880555408669531, 'lr': 0.036575730929409724, 'optimizer': 'Adam', 'lr_decay': 0.993387690347901}. Best is trial 44 with value: 0.8035019455252919.
[I 2024-04-03 16:45:47,816] Trial 183 pruned. 
[I 2024-04-03 16:45:47,880] Trial 184 pruned. 
[I 2024-04-03 16:45:47,944] Trial 185 pruned. 
[I 2024-04-03 16:46:07,553] Trial 186 finished with value: 0.791828793774319 and parameters: {'num_layers': 1, 'num_neurons': 105, 'dropout_rate': 0.34087325978014127, 'lr': 0.06554817088776117, 'optimizer': 'Adam', 'lr_decay': 0.9913378560420665}. Best is trial 44 with value: 0.8035019455252919.
[I 2024-04-03 16:46:07,617] Trial 187 pruned. 
[I 2024-04-03 16:46:25,638] Trial 188 finished with value: 0.7879377431906615 and parameters: {'num_layers': 1, 'num_neurons': 90, 'dropout_rate': 0.10047730627866708, 'lr': 0.08374418225504822, 'optimizer': 'RMSprop', 'lr_decay': 0.9975901218913692}. Best is trial 44 with value: 0.8035019455252919.
[I 2024-04-03 16:46:25,703] Trial 189 pruned. 
[I 2024-04-03 16:46:25,767] Trial 190 pruned. 
[I 2024-04-03 16:46:25,831] Trial 191 pruned. 
[I 2024-04-03 16:46:25,896] Trial 192 pruned. 
[I 2024-04-03 16:46:45,659] Trial 193 finished with value: 0.7957198443579766 and parameters: {'num_layers': 1, 'num_neurons': 144, 'dropout_rate': 0.13134803900273342, 'lr': 0.061646824142275854, 'optimizer': 'Adam', 'lr_decay': 0.9962960015647}. Best is trial 44 with value: 0.8035019455252919.
[I 2024-04-03 16:47:05,586] Trial 194 finished with value: 0.791828793774319 and parameters: {'num_layers': 1, 'num_neurons': 147, 'dropout_rate': 0.1307257243126321, 'lr': 0.05815519678199879, 'optimizer': 'Adam', 'lr_decay': 0.9999981063907123}. Best is trial 44 with value: 0.8035019455252919.
[I 2024-04-03 16:47:05,650] Trial 195 pruned. 
[I 2024-04-03 16:47:05,729] Trial 196 pruned. 
[I 2024-04-03 16:47:05,793] Trial 197 pruned. 
[I 2024-04-03 16:47:25,340] Trial 198 finished with value: 0.7879377431906615 and parameters: {'num_layers': 1, 'num_neurons': 95, 'dropout_rate': 0.12859633149367505, 'lr': 0.06646439091419576, 'optimizer': 'Adam', 'lr_decay': 0.9948588109864486}. Best is trial 44 with value: 0.8035019455252919.
[I 2024-04-03 16:47:25,404] Trial 199 pruned. 
[I 2024-04-03 16:47:25,468] Trial 200 pruned. 
[I 2024-04-03 16:47:25,533] Trial 201 pruned. 
[I 2024-04-03 16:47:25,597] Trial 202 pruned. 
[I 2024-04-03 16:47:45,346] Trial 203 finished with value: 0.8015564202334631 and parameters: {'num_layers': 1, 'num_neurons': 124, 'dropout_rate': 0.1402458160160256, 'lr': 0.07385744859645901, 'optimizer': 'Adam', 'lr_decay': 0.9991999154189395}. Best is trial 44 with value: 0.8035019455252919.
[I 2024-04-03 16:47:45,410] Trial 204 pruned. 
[I 2024-04-03 16:47:45,475] Trial 205 pruned. 
[I 2024-04-03 16:47:45,540] Trial 206 pruned. 
[I 2024-04-03 16:48:05,205] Trial 207 finished with value: 0.791828793774319 and parameters: {'num_layers': 1, 'num_neurons': 111, 'dropout_rate': 0.12090779095443867, 'lr': 0.07756920181703669, 'optimizer': 'Adam', 'lr_decay': 0.9982188372407229}. Best is trial 44 with value: 0.8035019455252919.
[I 2024-04-03 16:48:05,269] Trial 208 pruned. 
[I 2024-04-03 16:48:05,333] Trial 209 pruned. 
[I 2024-04-03 16:48:05,398] Trial 210 pruned. 
[I 2024-04-03 16:48:05,463] Trial 211 pruned. 
[I 2024-04-03 16:48:05,527] Trial 212 pruned. 
[I 2024-04-03 16:48:05,592] Trial 213 pruned. 
[I 2024-04-03 16:48:05,657] Trial 214 pruned. 
[I 2024-04-03 16:48:27,358] Trial 215 finished with value: 0.7996108949416343 and parameters: {'num_layers': 1, 'num_neurons': 505, 'dropout_rate': 0.15379725537437064, 'lr': 0.05981205093081533, 'optimizer': 'Adam', 'lr_decay': 0.9976142340215447}. Best is trial 44 with value: 0.8035019455252919.
[I 2024-04-03 16:48:27,419] Trial 216 pruned. 
[I 2024-04-03 16:48:27,487] Trial 217 pruned. 
[I 2024-04-03 16:48:27,552] Trial 218 pruned. 
[I 2024-04-03 16:48:27,617] Trial 219 pruned. 
[I 2024-04-03 16:48:27,685] Trial 220 pruned. 
[I 2024-04-03 16:48:27,750] Trial 221 pruned. 
[I 2024-04-03 16:48:27,819] Trial 222 pruned. 
[I 2024-04-03 16:48:27,887] Trial 223 pruned. 
[I 2024-04-03 16:48:28,023] Trial 224 pruned. 
[I 2024-04-03 16:48:28,091] Trial 225 pruned. 
[I 2024-04-03 16:48:28,154] Trial 226 pruned. 
[I 2024-04-03 16:48:28,225] Trial 227 pruned. 
[I 2024-04-03 16:48:28,291] Trial 228 pruned. 
[I 2024-04-03 16:48:28,358] Trial 229 pruned. 
[I 2024-04-03 16:48:28,423] Trial 230 pruned. 
[I 2024-04-03 16:48:28,489] Trial 231 pruned. 
[I 2024-04-03 16:48:28,556] Trial 232 pruned. 
[I 2024-04-03 16:48:48,237] Trial 233 finished with value: 0.7976653696498055 and parameters: {'num_layers': 1, 'num_neurons': 123, 'dropout_rate': 0.10024910314416972, 'lr': 0.025481329371288806, 'optimizer': 'Adam', 'lr_decay': 0.9992501289800092}. Best is trial 44 with value: 0.8035019455252919.
[I 2024-04-03 16:48:48,303] Trial 234 pruned. 
[I 2024-04-03 16:48:48,368] Trial 235 pruned. 
[I 2024-04-03 16:48:48,434] Trial 236 pruned. 
[I 2024-04-03 16:48:48,501] Trial 237 pruned. 
[I 2024-04-03 16:48:48,568] Trial 238 pruned. 
[I 2024-04-03 16:48:48,635] Trial 239 pruned. 
[I 2024-04-03 16:48:48,738] Trial 240 pruned. 
[I 2024-04-03 16:48:48,804] Trial 241 pruned. 
[I 2024-04-03 16:48:48,872] Trial 242 pruned. 
[I 2024-04-03 16:48:48,939] Trial 243 pruned. 
[I 2024-04-03 16:48:49,005] Trial 244 pruned. 
[I 2024-04-03 16:48:49,073] Trial 245 pruned. 
[I 2024-04-03 16:48:49,148] Trial 246 pruned. 
[I 2024-04-03 16:48:49,214] Trial 247 pruned. 
[I 2024-04-03 16:48:49,281] Trial 248 pruned. 
[I 2024-04-03 16:48:49,373] Trial 249 pruned. 
[I 2024-04-03 16:48:49,440] Trial 250 pruned. 
[I 2024-04-03 16:48:49,507] Trial 251 pruned. 
[I 2024-04-03 16:48:49,567] Trial 252 pruned. 
[I 2024-04-03 16:48:49,634] Trial 253 pruned. 
[I 2024-04-03 16:49:09,173] Trial 254 finished with value: 0.7898832684824902 and parameters: {'num_layers': 1, 'num_neurons': 102, 'dropout_rate': 0.141061154954044, 'lr': 0.04385606688612058, 'optimizer': 'Adam', 'lr_decay': 0.9922713199387306}. Best is trial 44 with value: 0.8035019455252919.
[I 2024-04-03 16:49:09,240] Trial 255 pruned. 
[I 2024-04-03 16:49:09,307] Trial 256 pruned. 
[I 2024-04-03 16:49:09,374] Trial 257 pruned. 
[I 2024-04-03 16:49:09,437] Trial 258 pruned. 
[I 2024-04-03 16:49:29,064] Trial 259 finished with value: 0.7937743190661478 and parameters: {'num_layers': 1, 'num_neurons': 114, 'dropout_rate': 0.13453940339469322, 'lr': 0.04667518116513072, 'optimizer': 'Adam', 'lr_decay': 0.9988087459019253}. Best is trial 44 with value: 0.8035019455252919.
[I 2024-04-03 16:49:29,132] Trial 260 pruned. 
[I 2024-04-03 16:49:48,915] Trial 261 finished with value: 0.7859922178988327 and parameters: {'num_layers': 1, 'num_neurons': 135, 'dropout_rate': 0.1641268261637881, 'lr': 0.08633824825104337, 'optimizer': 'Adam', 'lr_decay': 0.9763173721359885}. Best is trial 44 with value: 0.8035019455252919.
[I 2024-04-03 16:49:48,994] Trial 262 pruned. 
[I 2024-04-03 16:49:49,061] Trial 263 pruned. 
[I 2024-04-03 16:50:08,638] Trial 264 finished with value: 0.7937743190661478 and parameters: {'num_layers': 1, 'num_neurons': 105, 'dropout_rate': 0.12872373289319364, 'lr': 0.05221229581819274, 'optimizer': 'Adam', 'lr_decay': 0.997418912518507}. Best is trial 44 with value: 0.8035019455252919.
[I 2024-04-03 16:50:08,706] Trial 265 pruned. 
[I 2024-04-03 16:50:08,773] Trial 266 pruned. 
[I 2024-04-03 16:50:08,839] Trial 267 pruned. 
[I 2024-04-03 16:50:08,908] Trial 268 pruned. 
[I 2024-04-03 16:50:08,975] Trial 269 pruned. 
[I 2024-04-03 16:50:09,042] Trial 270 pruned. 
[I 2024-04-03 16:50:09,108] Trial 271 pruned. 
[I 2024-04-03 16:50:10,487] Trial 272 pruned. 
[I 2024-04-03 16:50:10,548] Trial 273 pruned. 
[I 2024-04-03 16:50:10,615] Trial 274 pruned. 
[I 2024-04-03 16:50:30,347] Trial 275 finished with value: 0.791828793774319 and parameters: {'num_layers': 1, 'num_neurons': 133, 'dropout_rate': 0.20751572309040986, 'lr': 0.03000274803072548, 'optimizer': 'Adam', 'lr_decay': 0.9970885667133581}. Best is trial 44 with value: 0.8035019455252919.
[I 2024-04-03 16:50:30,415] Trial 276 pruned. 
[I 2024-04-03 16:50:30,487] Trial 277 pruned. 
[I 2024-04-03 16:50:30,554] Trial 278 pruned. 
[I 2024-04-03 16:50:30,622] Trial 279 pruned. 
[I 2024-04-03 16:50:30,686] Trial 280 pruned. 
[I 2024-04-03 16:50:50,056] Trial 281 finished with value: 0.7976653696498055 and parameters: {'num_layers': 1, 'num_neurons': 54, 'dropout_rate': 0.11216321222203819, 'lr': 0.058661390941265296, 'optimizer': 'Adam', 'lr_decay': 0.9991972645964853}. Best is trial 44 with value: 0.8035019455252919.
[I 2024-04-03 16:51:09,332] Trial 282 finished with value: 0.8015564202334631 and parameters: {'num_layers': 1, 'num_neurons': 48, 'dropout_rate': 0.1116052062600508, 'lr': 0.05976165352516936, 'optimizer': 'Adam', 'lr_decay': 0.9978010071577479}. Best is trial 44 with value: 0.8035019455252919.
[I 2024-04-03 16:51:28,607] Trial 283 finished with value: 0.791828793774319 and parameters: {'num_layers': 1, 'num_neurons': 44, 'dropout_rate': 0.10038828105241697, 'lr': 0.051554760290977074, 'optimizer': 'Adam', 'lr_decay': 0.9979363041959641}. Best is trial 44 with value: 0.8035019455252919.
[I 2024-04-03 16:51:28,675] Trial 284 pruned. 
[I 2024-04-03 16:51:28,742] Trial 285 pruned. 
[I 2024-04-03 16:51:28,809] Trial 286 pruned. 
[I 2024-04-03 16:51:48,102] Trial 287 finished with value: 0.791828793774319 and parameters: {'num_layers': 1, 'num_neurons': 41, 'dropout_rate': 0.11876527545712107, 'lr': 0.07269326868081415, 'optimizer': 'Adam', 'lr_decay': 0.999198022912065}. Best is trial 44 with value: 0.8035019455252919.
[I 2024-04-03 16:52:07,461] Trial 288 finished with value: 0.791828793774319 and parameters: {'num_layers': 1, 'num_neurons': 57, 'dropout_rate': 0.11079609693631894, 'lr': 0.05017387308273407, 'optimizer': 'Adam', 'lr_decay': 0.996914893015633}. Best is trial 44 with value: 0.8035019455252919.
[I 2024-04-03 16:52:26,924] Trial 289 finished with value: 0.7957198443579766 and parameters: {'num_layers': 1, 'num_neurons': 68, 'dropout_rate': 0.12361499217579497, 'lr': 0.056527209690160576, 'optimizer': 'Adam', 'lr_decay': 0.9999865907972915}. Best is trial 44 with value: 0.8035019455252919.
[I 2024-04-03 16:52:26,992] Trial 290 pruned. 
[I 2024-04-03 16:52:27,060] Trial 291 pruned. 
[I 2024-04-03 16:52:46,422] Trial 292 finished with value: 0.8015564202334631 and parameters: {'num_layers': 1, 'num_neurons': 56, 'dropout_rate': 0.12183003930557161, 'lr': 0.07202514382648233, 'optimizer': 'Adam', 'lr_decay': 0.9979511311797017}. Best is trial 44 with value: 0.8035019455252919.
[I 2024-04-03 16:53:05,751] Trial 293 finished with value: 0.7996108949416343 and parameters: {'num_layers': 1, 'num_neurons': 53, 'dropout_rate': 0.10003443554925012, 'lr': 0.0757942505271559, 'optimizer': 'Adam', 'lr_decay': 0.9979569736599354}. Best is trial 44 with value: 0.8035019455252919.
[I 2024-04-03 16:53:05,818] Trial 294 pruned. 
[I 2024-04-03 16:53:05,886] Trial 295 pruned. 
[I 2024-04-03 16:53:05,963] Trial 296 pruned. 
[I 2024-04-03 16:53:06,031] Trial 297 pruned. 
[I 2024-04-03 16:53:06,093] Trial 298 pruned. 
[I 2024-04-03 16:53:06,161] Trial 299 pruned. 
[I 2024-04-03 16:53:06,230] Trial 300 pruned. 
[I 2024-04-03 16:53:06,318] Trial 301 pruned. 
[I 2024-04-03 16:53:25,641] Trial 302 finished with value: 0.791828793774319 and parameters: {'num_layers': 1, 'num_neurons': 54, 'dropout_rate': 0.12408075607119284, 'lr': 0.06867321245656807, 'optimizer': 'Adam', 'lr_decay': 0.9966484337618053}. Best is trial 44 with value: 0.8035019455252919.
[I 2024-04-03 16:53:25,709] Trial 303 pruned. 
[I 2024-04-03 16:53:25,774] Trial 304 pruned. 
[I 2024-04-03 16:53:25,843] Trial 305 pruned. 
[I 2024-04-03 16:53:25,910] Trial 306 pruned. 
[I 2024-04-03 16:53:25,979] Trial 307 pruned. 
[I 2024-04-03 16:53:26,047] Trial 308 pruned. 
[I 2024-04-03 16:53:45,352] Trial 309 finished with value: 0.7937743190661478 and parameters: {'num_layers': 1, 'num_neurons': 44, 'dropout_rate': 0.14186885846987726, 'lr': 0.06068195497676061, 'optimizer': 'Adam', 'lr_decay': 0.9987086021190162}. Best is trial 44 with value: 0.8035019455252919.
[I 2024-04-03 16:53:45,424] Trial 310 pruned. 
[I 2024-04-03 16:53:45,495] Trial 311 pruned. 
[I 2024-04-03 16:53:45,563] Trial 312 pruned. 
[I 2024-04-03 16:53:45,632] Trial 313 pruned. 
[I 2024-04-03 16:53:45,705] Trial 314 pruned. 
[I 2024-04-03 16:53:46,824] Trial 315 pruned. 
[I 2024-04-03 16:53:47,807] Trial 316 pruned. 
[I 2024-04-03 16:53:47,876] Trial 317 pruned. 
[I 2024-04-03 16:53:47,947] Trial 318 pruned. 
[I 2024-04-03 16:53:48,015] Trial 319 pruned. 
[I 2024-04-03 16:53:48,078] Trial 320 pruned. 
[I 2024-04-03 16:53:48,148] Trial 321 pruned. 
[I 2024-04-03 16:53:48,218] Trial 322 pruned. 
[I 2024-04-03 16:53:48,287] Trial 323 pruned. 
[I 2024-04-03 16:53:48,415] Trial 324 pruned. 
[I 2024-04-03 16:54:07,833] Trial 325 finished with value: 0.7937743190661478 and parameters: {'num_layers': 1, 'num_neurons': 61, 'dropout_rate': 0.1570595767265561, 'lr': 0.09853924934088829, 'optimizer': 'Adam', 'lr_decay': 0.9991558509727705}. Best is trial 44 with value: 0.8035019455252919.
[I 2024-04-03 16:54:07,912] Trial 326 pruned. 
[I 2024-04-03 16:54:07,979] Trial 327 pruned. 
[I 2024-04-03 16:54:27,610] Trial 328 finished with value: 0.7898832684824902 and parameters: {'num_layers': 1, 'num_neurons': 104, 'dropout_rate': 0.1383641966510233, 'lr': 0.04115347362293729, 'optimizer': 'Adam', 'lr_decay': 0.9962868939941496}. Best is trial 44 with value: 0.8035019455252919.
[I 2024-04-03 16:54:27,746] Trial 329 pruned. 
[I 2024-04-03 16:54:27,839] Trial 330 pruned. 
[I 2024-04-03 16:54:31,134] Trial 331 pruned. 
[I 2024-04-03 16:54:31,204] Trial 332 pruned. 
[I 2024-04-03 16:54:31,273] Trial 333 pruned. 
[I 2024-04-03 16:54:31,343] Trial 334 pruned. 
[I 2024-04-03 16:54:31,413] Trial 335 pruned. 
[I 2024-04-03 16:54:31,483] Trial 336 pruned. 
[I 2024-04-03 16:54:32,469] Trial 337 pruned. 
[I 2024-04-03 16:54:32,538] Trial 338 pruned. 
[I 2024-04-03 16:54:32,608] Trial 339 pruned. 
[I 2024-04-03 16:54:32,680] Trial 340 pruned. 
[I 2024-04-03 16:54:32,750] Trial 341 pruned. 
[I 2024-04-03 16:54:32,820] Trial 342 pruned. 
[I 2024-04-03 16:54:32,891] Trial 343 pruned. 
[I 2024-04-03 16:54:32,970] Trial 344 pruned. 
[I 2024-04-03 16:54:33,042] Trial 345 pruned. 
[I 2024-04-03 16:54:33,112] Trial 346 pruned. 
[I 2024-04-03 16:54:33,182] Trial 347 pruned. 
[I 2024-04-03 16:54:52,866] Trial 348 finished with value: 0.7937743190661478 and parameters: {'num_layers': 1, 'num_neurons': 109, 'dropout_rate': 0.12543528551975885, 'lr': 0.05387366851298007, 'optimizer': 'Adam', 'lr_decay': 0.997169685132223}. Best is trial 44 with value: 0.8035019455252919.
[I 2024-04-03 16:54:52,933] Trial 349 pruned. 
[I 2024-04-03 16:55:12,881] Trial 350 finished with value: 0.7898832684824902 and parameters: {'num_layers': 1, 'num_neurons': 125, 'dropout_rate': 0.10953590735547053, 'lr': 0.0998720586992459, 'optimizer': 'Adam', 'lr_decay': 0.9962551429566636}. Best is trial 44 with value: 0.8035019455252919.
[I 2024-04-03 16:55:12,953] Trial 351 pruned. 
[I 2024-04-03 16:55:32,899] Trial 352 finished with value: 0.7937743190661478 and parameters: {'num_layers': 1, 'num_neurons': 153, 'dropout_rate': 0.12987724507752443, 'lr': 0.07016724246335888, 'optimizer': 'Adam', 'lr_decay': 0.9990734534750806}. Best is trial 44 with value: 0.8035019455252919.
[I 2024-04-03 16:55:32,970] Trial 353 pruned. 
[I 2024-04-03 16:55:33,040] Trial 354 pruned. 
[I 2024-04-03 16:55:33,113] Trial 355 pruned. 
[I 2024-04-03 16:55:33,184] Trial 356 pruned. 
[I 2024-04-03 16:55:52,553] Trial 357 finished with value: 0.7859922178988327 and parameters: {'num_layers': 1, 'num_neurons': 53, 'dropout_rate': 0.14675357315508658, 'lr': 0.046243090337320575, 'optimizer': 'Adam', 'lr_decay': 0.9945454326464268}. Best is trial 44 with value: 0.8035019455252919.
[I 2024-04-03 16:55:52,624] Trial 358 pruned. 
[I 2024-04-03 16:55:52,696] Trial 359 pruned. 
[I 2024-04-03 16:55:52,766] Trial 360 pruned. 
[I 2024-04-03 16:55:52,837] Trial 361 pruned. 
[I 2024-04-03 16:55:52,908] Trial 362 pruned. 
[I 2024-04-03 16:55:53,011] Trial 363 pruned. 
[I 2024-04-03 16:55:53,083] Trial 364 pruned. 
[I 2024-04-03 16:55:53,152] Trial 365 pruned. 
[I 2024-04-03 16:55:53,223] Trial 366 pruned. 
[I 2024-04-03 16:55:53,314] Trial 367 pruned. 
[I 2024-04-03 16:56:13,203] Trial 368 finished with value: 0.7821011673151751 and parameters: {'num_layers': 1, 'num_neurons': 147, 'dropout_rate': 0.1766025436467465, 'lr': 0.07165020087853108, 'optimizer': 'Adam', 'lr_decay': 0.9708673145632557}. Best is trial 44 with value: 0.8035019455252919.
[I 2024-04-03 16:56:13,274] Trial 369 pruned. 
[I 2024-04-03 16:56:13,345] Trial 370 pruned. 
[I 2024-04-03 16:56:13,412] Trial 371 pruned. 
[I 2024-04-03 16:56:13,483] Trial 372 pruned. 
[I 2024-04-03 16:56:13,557] Trial 373 pruned. 
[I 2024-04-03 16:56:13,628] Trial 374 pruned. 
[I 2024-04-03 16:56:13,700] Trial 375 pruned. 
[I 2024-04-03 16:56:33,480] Trial 376 finished with value: 0.7937743190661478 and parameters: {'num_layers': 1, 'num_neurons': 121, 'dropout_rate': 0.19380564013648807, 'lr': 0.06390684501987964, 'optimizer': 'Adam', 'lr_decay': 0.9963776640263462}. Best is trial 44 with value: 0.8035019455252919.
[I 2024-04-03 16:56:33,550] Trial 377 pruned. 
[I 2024-04-03 16:56:33,623] Trial 378 pruned. 
[I 2024-04-03 16:56:53,294] Trial 379 finished with value: 0.7879377431906615 and parameters: {'num_layers': 1, 'num_neurons': 101, 'dropout_rate': 0.11352949392673234, 'lr': 0.08584483627323296, 'optimizer': 'Adam', 'lr_decay': 0.995397185471048}. Best is trial 44 with value: 0.8035019455252919.
[I 2024-04-03 16:56:53,366] Trial 380 pruned. 
[I 2024-04-03 16:56:53,439] Trial 381 pruned. 
[I 2024-04-03 16:56:53,510] Trial 382 pruned. 
[I 2024-04-03 16:56:53,592] Trial 383 pruned. 
[I 2024-04-03 16:56:53,664] Trial 384 pruned. 
[I 2024-04-03 16:57:13,522] Trial 385 finished with value: 0.7898832684824902 and parameters: {'num_layers': 1, 'num_neurons': 110, 'dropout_rate': 0.10024365294718081, 'lr': 0.07584983154919435, 'optimizer': 'Adam', 'lr_decay': 0.9999548683702157}. Best is trial 44 with value: 0.8035019455252919.
[I 2024-04-03 16:57:13,594] Trial 386 pruned. 
[I 2024-04-03 16:57:13,666] Trial 387 pruned. 
[I 2024-04-03 16:57:13,731] Trial 388 pruned. 
[I 2024-04-03 16:57:13,814] Trial 389 pruned. 
[I 2024-04-03 16:57:33,676] Trial 390 finished with value: 0.7879377431906615 and parameters: {'num_layers': 1, 'num_neurons': 142, 'dropout_rate': 0.11793006617142315, 'lr': 0.0481947666266257, 'optimizer': 'Adam', 'lr_decay': 0.995277736315611}. Best is trial 44 with value: 0.8035019455252919.
[I 2024-04-03 16:57:33,748] Trial 391 pruned. 
[I 2024-04-03 16:57:33,821] Trial 392 pruned. 
[I 2024-04-03 16:57:33,889] Trial 393 pruned. 
[I 2024-04-03 16:57:33,960] Trial 394 pruned. 
[I 2024-04-03 16:57:34,032] Trial 395 pruned. 
[I 2024-04-03 16:57:34,104] Trial 396 pruned. 
[I 2024-04-03 16:57:34,175] Trial 397 pruned. 
[I 2024-04-03 16:57:34,247] Trial 398 pruned. 
[I 2024-04-03 16:57:34,324] Trial 399 pruned. 
[I 2024-04-03 16:57:34,396] Trial 400 pruned. 
[I 2024-04-03 16:57:34,468] Trial 401 pruned. 
[I 2024-04-03 16:57:34,540] Trial 402 pruned. 
[I 2024-04-03 16:57:34,613] Trial 403 pruned. 
[I 2024-04-03 16:57:34,685] Trial 404 pruned. 
[I 2024-04-03 16:57:34,757] Trial 405 pruned. 
[I 2024-04-03 16:57:34,829] Trial 406 pruned. 
[I 2024-04-03 16:57:34,902] Trial 407 pruned. 
[I 2024-04-03 16:57:34,977] Trial 408 pruned. 
[I 2024-04-03 16:57:35,087] Trial 409 pruned. 
[I 2024-04-03 16:57:35,155] Trial 410 pruned. 
[I 2024-04-03 16:57:35,227] Trial 411 pruned. 
[I 2024-04-03 16:57:35,299] Trial 412 pruned. 
[I 2024-04-03 16:57:35,372] Trial 413 pruned. 
[I 2024-04-03 16:57:54,938] Trial 414 finished with value: 0.7957198443579766 and parameters: {'num_layers': 1, 'num_neurons': 82, 'dropout_rate': 0.1317828381969744, 'lr': 0.07215824096095554, 'optimizer': 'Adam', 'lr_decay': 0.9940657623201583}. Best is trial 44 with value: 0.8035019455252919.
[I 2024-04-03 16:57:55,012] Trial 415 pruned. 
[I 2024-04-03 16:57:55,081] Trial 416 pruned. 
[I 2024-04-03 16:58:14,766] Trial 417 finished with value: 0.791828793774319 and parameters: {'num_layers': 1, 'num_neurons': 79, 'dropout_rate': 0.14758672549315, 'lr': 0.06763432548669344, 'optimizer': 'Adam', 'lr_decay': 0.9991739964438612}. Best is trial 44 with value: 0.8035019455252919.
[I 2024-04-03 16:58:14,863] Trial 418 pruned. 
