[I 2024-04-03 19:27:50,063] Trial 343 finished with value: 0.791828793774319 and parameters: {'num_layers': 5, 'num_neurons': 354, 'dropout_rate': 0.15384366212034667, 'lr': 0.04720726410501562, 'optimizer': 'Adam', 'lr_decay': 0.9937949442382977, 'activation': 'LeakyReLU'}. Best is trial 297 with value: 0.8073929961089494.
[I 2024-04-03 19:28:26,334] Trial 344 finished with value: 0.8015564202334631 and parameters: {'num_layers': 4, 'num_neurons': 76, 'dropout_rate': 0.16836246105924532, 'lr': 0.0661969871601871, 'optimizer': 'Adam', 'lr_decay': 0.9961331852887423, 'activation': 'LeakyReLU'}. Best is trial 297 with value: 0.8073929961089494.
[I 2024-04-03 19:28:26,455] Trial 345 pruned. 
[I 2024-04-03 19:28:26,575] Trial 346 pruned. 
[I 2024-04-03 19:29:03,164] Trial 347 finished with value: 0.7898832684824902 and parameters: {'num_layers': 4, 'num_neurons': 86, 'dropout_rate': 0.15034597997495053, 'lr': 0.06126722000542484, 'optimizer': 'Adam', 'lr_decay': 0.9958505190563494, 'activation': 'LeakyReLU'}. Best is trial 297 with value: 0.8073929961089494.
[I 2024-04-03 19:29:03,285] Trial 348 pruned. 
[I 2024-04-03 19:29:03,393] Trial 349 pruned. 
[I 2024-04-03 19:29:20,485] Trial 350 pruned. 
[I 2024-04-03 19:29:20,606] Trial 351 pruned. 
[I 2024-04-03 19:29:20,725] Trial 352 pruned. 
[I 2024-04-03 19:29:24,616] Trial 353 pruned. 
[I 2024-04-03 19:29:29,770] Trial 354 pruned. 
[I 2024-04-03 19:30:06,448] Trial 355 finished with value: 0.7821011673151751 and parameters: {'num_layers': 4, 'num_neurons': 92, 'dropout_rate': 0.1557567939031052, 'lr': 0.03770508472383904, 'optimizer': 'Adam', 'lr_decay': 0.9934785269406304, 'activation': 'LeakyReLU'}. Best is trial 297 with value: 0.8073929961089494.
[I 2024-04-03 19:30:06,567] Trial 356 pruned. 
[I 2024-04-03 19:30:48,372] Trial 357 finished with value: 0.7879377431906615 and parameters: {'num_layers': 5, 'num_neurons': 76, 'dropout_rate': 0.13043427076965142, 'lr': 0.08266168980028989, 'optimizer': 'Adam', 'lr_decay': 0.9977474872900647, 'activation': 'LeakyReLU'}. Best is trial 297 with value: 0.8073929961089494.
[I 2024-04-03 19:30:48,491] Trial 358 pruned. 
[I 2024-04-03 19:30:53,174] Trial 359 pruned. 
[I 2024-04-03 19:30:53,283] Trial 360 pruned. 
[I 2024-04-03 19:31:43,422] Trial 361 finished with value: 0.7859922178988327 and parameters: {'num_layers': 5, 'num_neurons': 250, 'dropout_rate': 0.1555097501896392, 'lr': 0.06545938213874085, 'optimizer': 'Adam', 'lr_decay': 0.9958814681261103, 'activation': 'LeakyReLU'}. Best is trial 297 with value: 0.8073929961089494.
[I 2024-04-03 19:32:18,725] Trial 362 finished with value: 0.7859922178988327 and parameters: {'num_layers': 4, 'num_neurons': 47, 'dropout_rate': 0.11698069201048107, 'lr': 0.05531685471043096, 'optimizer': 'Adam', 'lr_decay': 0.9969716273901555, 'activation': 'LeakyReLU'}. Best is trial 297 with value: 0.8073929961089494.
[I 2024-04-03 19:32:18,873] Trial 363 pruned. 
[I 2024-04-03 19:32:18,992] Trial 364 pruned. 
[I 2024-04-03 19:32:19,092] Trial 365 pruned. 
[I 2024-04-03 19:32:19,210] Trial 366 pruned. 
[I 2024-04-03 19:32:19,329] Trial 367 pruned. 
[I 2024-04-03 19:32:19,475] Trial 368 pruned. 
[I 2024-04-03 19:32:19,583] Trial 369 pruned. 
[I 2024-04-03 19:33:05,210] Trial 370 finished with value: 0.7879377431906615 and parameters: {'num_layers': 4, 'num_neurons': 377, 'dropout_rate': 0.138813060226193, 'lr': 0.07515185411707456, 'optimizer': 'Adam', 'lr_decay': 0.9965461743139549, 'activation': 'LeakyReLU'}. Best is trial 297 with value: 0.8073929961089494.
[I 2024-04-03 19:33:05,328] Trial 371 pruned. 
[I 2024-04-03 19:33:05,448] Trial 372 pruned. 
[I 2024-04-03 19:33:05,562] Trial 373 pruned. 
[I 2024-04-03 19:33:05,670] Trial 374 pruned. 
[I 2024-04-03 19:33:21,089] Trial 375 pruned. 
[I 2024-04-03 19:34:01,739] Trial 376 finished with value: 0.7840466926070039 and parameters: {'num_layers': 5, 'num_neurons': 54, 'dropout_rate': 0.21781611418378952, 'lr': 0.08617030093428084, 'optimizer': 'Adam', 'lr_decay': 0.9967520340913746, 'activation': 'LeakyReLU'}. Best is trial 297 with value: 0.8073929961089494.
[I 2024-04-03 19:34:11,388] Trial 377 pruned. 
[I 2024-04-03 19:34:55,884] Trial 378 finished with value: 0.7957198443579766 and parameters: {'num_layers': 5, 'num_neurons': 147, 'dropout_rate': 0.1740552863970843, 'lr': 0.06874659304413744, 'optimizer': 'Adam', 'lr_decay': 0.9991645111670041, 'activation': 'LeakyReLU'}. Best is trial 297 with value: 0.8073929961089494.
[I 2024-04-03 19:35:09,950] Trial 379 pruned. 
[I 2024-04-03 19:35:56,248] Trial 380 finished with value: 0.7879377431906615 and parameters: {'num_layers': 5, 'num_neurons': 177, 'dropout_rate': 0.16929571700891582, 'lr': 0.0009650266155871703, 'optimizer': 'Adam', 'lr_decay': 0.9979406373545271, 'activation': 'LeakyReLU'}. Best is trial 297 with value: 0.8073929961089494.
[I 2024-04-03 19:35:56,371] Trial 381 pruned. 
[I 2024-04-03 19:35:56,504] Trial 382 pruned. 
[I 2024-04-03 19:36:41,549] Trial 383 finished with value: 0.8073929961089494 and parameters: {'num_layers': 5, 'num_neurons': 157, 'dropout_rate': 0.18226293723882245, 'lr': 0.0021198071477549372, 'optimizer': 'Adam', 'lr_decay': 0.999961622005679, 'activation': 'LeakyReLU'}. Best is trial 297 with value: 0.8073929961089494.
[I 2024-04-03 19:37:25,710] Trial 384 finished with value: 0.791828793774319 and parameters: {'num_layers': 5, 'num_neurons': 140, 'dropout_rate': 0.18427711107107902, 'lr': 0.03146699822559664, 'optimizer': 'Adam', 'lr_decay': 0.9991798698733575, 'activation': 'LeakyReLU'}. Best is trial 297 with value: 0.8073929961089494.
[I 2024-04-03 19:38:10,029] Trial 385 finished with value: 0.7879377431906615 and parameters: {'num_layers': 5, 'num_neurons': 143, 'dropout_rate': 0.20566615075680994, 'lr': 0.002079015951310349, 'optimizer': 'Adam', 'lr_decay': 0.9958944498265675, 'activation': 'LeakyReLU'}. Best is trial 297 with value: 0.8073929961089494.
[I 2024-04-03 19:38:10,151] Trial 386 pruned. 
[I 2024-04-03 19:38:51,159] Trial 387 finished with value: 0.7879377431906615 and parameters: {'num_layers': 5, 'num_neurons': 62, 'dropout_rate': 0.18522681404476007, 'lr': 0.0039347199372407535, 'optimizer': 'Adam', 'lr_decay': 0.9982263658010094, 'activation': 'LeakyReLU'}. Best is trial 297 with value: 0.8073929961089494.
[I 2024-04-03 19:38:51,285] Trial 388 pruned. 
[I 2024-04-03 19:38:51,391] Trial 389 pruned. 
[I 2024-04-03 19:38:51,510] Trial 390 pruned. 
[I 2024-04-03 19:38:51,639] Trial 391 pruned. 
[I 2024-04-03 19:38:51,769] Trial 392 pruned. 
[I 2024-04-03 19:38:51,897] Trial 393 pruned. 
[I 2024-04-03 19:38:56,549] Trial 394 pruned. 
[I 2024-04-03 19:39:47,084] Trial 395 finished with value: 0.7937743190661478 and parameters: {'num_layers': 5, 'num_neurons': 286, 'dropout_rate': 0.18087287213664674, 'lr': 0.05218355617141725, 'optimizer': 'Adam', 'lr_decay': 0.9967279180252343, 'activation': 'LeakyReLU'}. Best is trial 297 with value: 0.8073929961089494.
[I 2024-04-03 19:39:47,211] Trial 396 pruned. 
[I 2024-04-03 19:40:29,042] Trial 397 finished with value: 0.791828793774319 and parameters: {'num_layers': 5, 'num_neurons': 77, 'dropout_rate': 0.2138746406094575, 'lr': 0.0816954099690079, 'optimizer': 'Adam', 'lr_decay': 0.9990372698231657, 'activation': 'LeakyReLU'}. Best is trial 297 with value: 0.8073929961089494.
[I 2024-04-03 19:40:29,180] Trial 398 pruned. 
[I 2024-04-03 19:40:29,307] Trial 399 pruned. 
[I 2024-04-03 19:40:29,459] Trial 400 pruned. 
[I 2024-04-03 19:40:59,763] Trial 401 finished with value: 0.7859922178988327 and parameters: {'num_layers': 5, 'num_neurons': 53, 'dropout_rate': 0.19136617582732773, 'lr': 0.048550096201356495, 'optimizer': 'SGD', 'lr_decay': 0.9984445334291655, 'activation': 'LeakyReLU'}. Best is trial 297 with value: 0.8073929961089494.
[I 2024-04-03 19:41:41,437] Trial 402 finished with value: 0.7976653696498055 and parameters: {'num_layers': 5, 'num_neurons': 71, 'dropout_rate': 0.228015781366923, 'lr': 0.06302270014585412, 'optimizer': 'Adam', 'lr_decay': 0.9991784576169237, 'activation': 'LeakyReLU'}. Best is trial 297 with value: 0.8073929961089494.
[I 2024-04-03 19:41:41,560] Trial 403 pruned. 
[I 2024-04-03 19:41:41,700] Trial 404 pruned. 
[I 2024-04-03 19:41:41,821] Trial 405 pruned. 
[I 2024-04-03 19:42:26,476] Trial 406 finished with value: 0.7937743190661478 and parameters: {'num_layers': 5, 'num_neurons': 151, 'dropout_rate': 0.22704007529185338, 'lr': 0.0596704675021714, 'optimizer': 'Adam', 'lr_decay': 0.9985278375993571, 'activation': 'LeakyReLU'}. Best is trial 297 with value: 0.8073929961089494.
[I 2024-04-03 19:43:08,058] Trial 407 finished with value: 0.7957198443579766 and parameters: {'num_layers': 5, 'num_neurons': 67, 'dropout_rate': 0.1425962063899842, 'lr': 0.08327931157359456, 'optimizer': 'Adam', 'lr_decay': 0.9992067007027017, 'activation': 'LeakyReLU'}. Best is trial 297 with value: 0.8073929961089494.
[I 2024-04-03 19:43:08,179] Trial 408 pruned. 
[I 2024-04-03 19:43:12,441] Trial 409 pruned. 
[I 2024-04-03 19:43:12,560] Trial 410 pruned. 
[I 2024-04-03 19:43:32,125] Trial 411 finished with value: 0.7879377431906615 and parameters: {'num_layers': 1, 'num_neurons': 62, 'dropout_rate': 0.12439794166744274, 'lr': 0.08955806219788098, 'optimizer': 'Adam', 'lr_decay': 0.9789278441315409, 'activation': 'LeakyReLU'}. Best is trial 297 with value: 0.8073929961089494.
[I 2024-04-03 19:44:14,025] Trial 412 finished with value: 0.791828793774319 and parameters: {'num_layers': 5, 'num_neurons': 82, 'dropout_rate': 0.14534439565475502, 'lr': 0.0698917406667188, 'optimizer': 'Adam', 'lr_decay': 0.9986063391764818, 'activation': 'LeakyReLU'}. Best is trial 297 with value: 0.8073929961089494.
[I 2024-04-03 19:44:14,143] Trial 413 pruned. 
[I 2024-04-03 19:44:45,081] Trial 414 finished with value: 0.7859922178988327 and parameters: {'num_layers': 5, 'num_neurons': 72, 'dropout_rate': 0.1363115697687586, 'lr': 0.09747699726475181, 'optimizer': 'SGD', 'lr_decay': 0.9974182230229649, 'activation': 'LeakyReLU'}. Best is trial 297 with value: 0.8073929961089494.
[I 2024-04-03 19:44:45,212] Trial 415 pruned. 
[I 2024-04-03 19:45:27,255] Trial 416 finished with value: 0.791828793774319 and parameters: {'num_layers': 5, 'num_neurons': 86, 'dropout_rate': 0.16378343316670158, 'lr': 0.07678585127967207, 'optimizer': 'Adam', 'lr_decay': 0.9993068484123572, 'activation': 'LeakyReLU'}. Best is trial 297 with value: 0.8073929961089494.
[I 2024-04-03 19:45:35,922] Trial 417 pruned. 
[I 2024-04-03 19:46:15,983] Trial 418 finished with value: 0.7859922178988327 and parameters: {'num_layers': 5, 'num_neurons': 46, 'dropout_rate': 0.17677444825846514, 'lr': 0.09994078194033194, 'optimizer': 'Adam', 'lr_decay': 0.9978142944729113, 'activation': 'LeakyReLU'}. Best is trial 297 with value: 0.8073929961089494.
[I 2024-04-03 19:46:57,506] Trial 419 finished with value: 0.7821011673151751 and parameters: {'num_layers': 5, 'num_neurons': 68, 'dropout_rate': 0.1395881890848881, 'lr': 0.057765515975070805, 'optimizer': 'Adam', 'lr_decay': 0.998239080940174, 'activation': 'Sigmoid'}. Best is trial 297 with value: 0.8073929961089494.
[I 2024-04-03 19:46:57,653] Trial 420 pruned. 
[I 2024-04-03 19:47:49,811] Trial 421 finished with value: 0.7859922178988327 and parameters: {'num_layers': 5, 'num_neurons': 323, 'dropout_rate': 0.16470458542973554, 'lr': 0.049664407322001884, 'optimizer': 'Adam', 'lr_decay': 0.9708271020063738, 'activation': 'LeakyReLU'}. Best is trial 297 with value: 0.8073929961089494.
[I 2024-04-03 19:47:49,932] Trial 422 pruned. 
[I 2024-04-03 19:48:31,656] Trial 423 finished with value: 0.791828793774319 and parameters: {'num_layers': 5, 'num_neurons': 78, 'dropout_rate': 0.13234711430744758, 'lr': 0.08343074630964607, 'optimizer': 'Adam', 'lr_decay': 0.9969091787971003, 'activation': 'LeakyReLU'}. Best is trial 297 with value: 0.8073929961089494.
[I 2024-04-03 19:49:13,120] Trial 424 finished with value: 0.7996108949416343 and parameters: {'num_layers': 5, 'num_neurons': 469, 'dropout_rate': 0.1809036113615532, 'lr': 0.056271480937102554, 'optimizer': 'SGD', 'lr_decay': 0.9999930472267236, 'activation': 'LeakyReLU'}. Best is trial 297 with value: 0.8073929961089494.
[I 2024-04-03 19:49:13,252] Trial 425 pruned. 
[I 2024-04-03 19:49:13,378] Trial 426 pruned. 
[I 2024-04-03 19:49:42,990] Trial 427 finished with value: 0.7840466926070039 and parameters: {'num_layers': 5, 'num_neurons': 40, 'dropout_rate': 0.16366220604404122, 'lr': 0.058491431022491464, 'optimizer': 'SGD', 'lr_decay': 0.9980772056965972, 'activation': 'LeakyReLU'}. Best is trial 297 with value: 0.8073929961089494.
[I 2024-04-03 19:49:43,114] Trial 428 pruned. 
[I 2024-04-03 19:49:43,237] Trial 429 pruned. 
[I 2024-04-03 19:50:12,986] Trial 430 finished with value: 0.7821011673151751 and parameters: {'num_layers': 5, 'num_neurons': 48, 'dropout_rate': 0.1742662299302675, 'lr': 0.04246387575248473, 'optimizer': 'SGD', 'lr_decay': 0.9984380863272927, 'activation': 'LeakyReLU'}. Best is trial 297 with value: 0.8073929961089494.
[I 2024-04-03 19:50:15,575] Trial 431 pruned. 
[I 2024-04-03 19:50:15,705] Trial 432 pruned. 
[I 2024-04-03 19:50:15,833] Trial 433 pruned. 
[I 2024-04-03 19:50:15,976] Trial 434 pruned. 
[I 2024-04-03 19:50:16,131] Trial 435 pruned. 
[I 2024-04-03 19:50:16,261] Trial 436 pruned. 
[I 2024-04-03 19:50:16,412] Trial 437 pruned. 
[I 2024-04-03 19:50:16,536] Trial 438 pruned. 
[I 2024-04-03 19:50:16,661] Trial 439 pruned. 
[I 2024-04-03 19:50:19,212] Trial 440 pruned. 
[I 2024-04-03 19:50:54,798] Trial 441 finished with value: 0.7840466926070039 and parameters: {'num_layers': 5, 'num_neurons': 53, 'dropout_rate': 0.16317398838576608, 'lr': 0.056132641055911446, 'optimizer': 'RMSprop', 'lr_decay': 0.9967661409212168, 'activation': 'Sigmoid'}. Best is trial 297 with value: 0.8073929961089494.
[I 2024-04-03 19:51:48,965] Trial 442 finished with value: 0.8093385214007782 and parameters: {'num_layers': 5, 'num_neurons': 413, 'dropout_rate': 0.10995077462546567, 'lr': 0.0008524901825723803, 'optimizer': 'Adam', 'lr_decay': 0.9989951977885069, 'activation': 'LeakyReLU'}. Best is trial 442 with value: 0.8093385214007782.
[I 2024-04-03 19:52:44,892] Trial 443 finished with value: 0.8151750972762646 and parameters: {'num_layers': 5, 'num_neurons': 479, 'dropout_rate': 0.11267112658551673, 'lr': 0.0008753247239029507, 'optimizer': 'Adam', 'lr_decay': 0.9999724454401938, 'activation': 'LeakyReLU'}. Best is trial 443 with value: 0.8151750972762646.
[I 2024-04-03 19:53:41,403] Trial 444 finished with value: 0.8054474708171206 and parameters: {'num_layers': 5, 'num_neurons': 478, 'dropout_rate': 0.10633905571158385, 'lr': 0.0008054969778139149, 'optimizer': 'Adam', 'lr_decay': 0.9999685556827808, 'activation': 'LeakyReLU'}. Best is trial 443 with value: 0.8151750972762646.
[I 2024-04-03 19:54:36,701] Trial 445 finished with value: 0.8151750972762646 and parameters: {'num_layers': 5, 'num_neurons': 488, 'dropout_rate': 0.10043330924113955, 'lr': 0.0008258315330604321, 'optimizer': 'Adam', 'lr_decay': 0.9999727670285387, 'activation': 'LeakyReLU'}. Best is trial 443 with value: 0.8151750972762646.
[I 2024-04-03 19:54:36,869] Trial 446 pruned. 
[I 2024-04-03 19:54:36,972] Trial 447 pruned. 
[I 2024-04-03 19:54:37,142] Trial 448 pruned. 
[I 2024-04-03 19:54:37,268] Trial 449 pruned. 
[I 2024-04-03 19:55:32,133] Trial 450 finished with value: 0.811284046692607 and parameters: {'num_layers': 5, 'num_neurons': 444, 'dropout_rate': 0.10603158351391359, 'lr': 0.0006980463090011993, 'optimizer': 'Adam', 'lr_decay': 0.999228494042989, 'activation': 'LeakyReLU'}. Best is trial 443 with value: 0.8151750972762646.
[I 2024-04-03 19:56:29,364] Trial 451 finished with value: 0.8015564202334631 and parameters: {'num_layers': 5, 'num_neurons': 511, 'dropout_rate': 0.11446203473019098, 'lr': 0.0006731781284568588, 'optimizer': 'Adam', 'lr_decay': 0.9991134270423779, 'activation': 'LeakyReLU'}. Best is trial 443 with value: 0.8151750972762646.
[I 2024-04-03 19:57:24,875] Trial 452 finished with value: 0.8054474708171206 and parameters: {'num_layers': 5, 'num_neurons': 459, 'dropout_rate': 0.1100469044961731, 'lr': 0.0006998294455499821, 'optimizer': 'Adam', 'lr_decay': 0.9990279574347899, 'activation': 'LeakyReLU'}. Best is trial 443 with value: 0.8151750972762646.
[I 2024-04-03 19:57:25,022] Trial 453 pruned. 
[I 2024-04-03 19:57:25,152] Trial 454 pruned. 
[I 2024-04-03 19:57:25,310] Trial 455 pruned. 
[I 2024-04-03 19:57:25,473] Trial 456 pruned. 
[I 2024-04-03 19:57:25,636] Trial 457 pruned. 
[I 2024-04-03 19:58:24,316] Trial 458 finished with value: 0.7879377431906615 and parameters: {'num_layers': 5, 'num_neurons': 460, 'dropout_rate': 0.11686388047606706, 'lr': 0.0005622657020675659, 'optimizer': 'Adam', 'lr_decay': 0.9905727509714055, 'activation': 'LeakyReLU'}. Best is trial 443 with value: 0.8151750972762646.
[I 2024-04-03 19:59:20,804] Trial 459 finished with value: 0.8073929961089494 and parameters: {'num_layers': 5, 'num_neurons': 478, 'dropout_rate': 0.10728340752718232, 'lr': 0.0010617176550344902, 'optimizer': 'Adam', 'lr_decay': 0.9986015277200502, 'activation': 'LeakyReLU'}. Best is trial 443 with value: 0.8151750972762646.
[I 2024-04-03 19:59:20,962] Trial 460 pruned. 
[I 2024-04-03 19:59:21,121] Trial 461 pruned. 
[I 2024-04-03 20:00:17,418] Trial 462 finished with value: 0.8015564202334631 and parameters: {'num_layers': 5, 'num_neurons': 495, 'dropout_rate': 0.11925896529351424, 'lr': 0.0004495533419090386, 'optimizer': 'Adam', 'lr_decay': 0.9989914102018604, 'activation': 'LeakyReLU'}. Best is trial 443 with value: 0.8151750972762646.
[I 2024-04-03 20:00:17,553] Trial 463 pruned. 
[I 2024-04-03 20:01:14,106] Trial 464 finished with value: 0.7996108949416343 and parameters: {'num_layers': 5, 'num_neurons': 498, 'dropout_rate': 0.11993168873821877, 'lr': 0.000653242957141736, 'optimizer': 'Adam', 'lr_decay': 0.9991625626953369, 'activation': 'LeakyReLU'}. Best is trial 443 with value: 0.8151750972762646.
[I 2024-04-03 20:01:14,268] Trial 465 pruned. 
[I 2024-04-03 20:02:10,352] Trial 466 finished with value: 0.8210116731517509 and parameters: {'num_layers': 5, 'num_neurons': 491, 'dropout_rate': 0.12028842920141192, 'lr': 0.000499675851090991, 'optimizer': 'Adam', 'lr_decay': 0.9999914993467703, 'activation': 'LeakyReLU'}. Best is trial 466 with value: 0.8210116731517509.
[I 2024-04-03 20:03:06,920] Trial 467 finished with value: 0.8093385214007782 and parameters: {'num_layers': 5, 'num_neurons': 498, 'dropout_rate': 0.10102856998392956, 'lr': 0.0004822478625065793, 'optimizer': 'Adam', 'lr_decay': 0.9999198085399494, 'activation': 'LeakyReLU'}. Best is trial 466 with value: 0.8210116731517509.
[I 2024-04-03 20:03:07,082] Trial 468 pruned. 
[I 2024-04-03 20:04:02,797] Trial 469 finished with value: 0.8210116731517509 and parameters: {'num_layers': 5, 'num_neurons': 488, 'dropout_rate': 0.11954139371924577, 'lr': 0.00043202147085033874, 'optimizer': 'Adam', 'lr_decay': 0.9999364572644879, 'activation': 'LeakyReLU'}. Best is trial 466 with value: 0.8210116731517509.
[I 2024-04-03 20:04:02,958] Trial 470 pruned. 
[I 2024-04-03 20:04:03,118] Trial 471 pruned. 
[I 2024-04-03 20:04:03,275] Trial 472 pruned. 
[I 2024-04-03 20:04:03,436] Trial 473 pruned. 
[I 2024-04-03 20:04:59,101] Trial 474 finished with value: 0.7976653696498055 and parameters: {'num_layers': 5, 'num_neurons': 471, 'dropout_rate': 0.11473038294885875, 'lr': 0.0002664419272207187, 'optimizer': 'Adam', 'lr_decay': 0.9985306815175136, 'activation': 'LeakyReLU'}. Best is trial 466 with value: 0.8210116731517509.
[I 2024-04-03 20:05:48,812] Trial 475 finished with value: 0.7996108949416343 and parameters: {'num_layers': 5, 'num_neurons': 485, 'dropout_rate': 0.1000807342477702, 'lr': 0.00027096088371692965, 'optimizer': 'RMSprop', 'lr_decay': 0.9987311734640807, 'activation': 'LeakyReLU'}. Best is trial 466 with value: 0.8210116731517509.
[I 2024-04-03 20:05:48,960] Trial 476 pruned. 
[I 2024-04-03 20:05:49,108] Trial 477 pruned. 
[I 2024-04-03 20:06:40,333] Trial 478 finished with value: 0.7782101167315175 and parameters: {'num_layers': 5, 'num_neurons': 499, 'dropout_rate': 0.10026673429636616, 'lr': 0.00046333925122870706, 'optimizer': 'RMSprop', 'lr_decay': 0.9986090052520569, 'activation': 'Sigmoid'}. Best is trial 466 with value: 0.8210116731517509.
[I 2024-04-03 20:07:08,356] Trial 479 finished with value: 0.7976653696498055 and parameters: {'num_layers': 2, 'num_neurons': 475, 'dropout_rate': 0.11696500291139646, 'lr': 0.0007691639980570334, 'optimizer': 'RMSprop', 'lr_decay': 0.99898884149568, 'activation': 'LeakyReLU'}. Best is trial 466 with value: 0.8210116731517509.
[I 2024-04-03 20:07:08,503] Trial 480 pruned. 
[I 2024-04-03 20:07:08,651] Trial 481 pruned. 
[I 2024-04-03 20:07:08,794] Trial 482 pruned. 
[I 2024-04-03 20:08:00,798] Trial 483 finished with value: 0.7937743190661478 and parameters: {'num_layers': 5, 'num_neurons': 512, 'dropout_rate': 0.11339169872967995, 'lr': 0.00015623614728284908, 'optimizer': 'RMSprop', 'lr_decay': 0.9982881846711891, 'activation': 'LeakyReLU'}. Best is trial 466 with value: 0.8210116731517509.
[I 2024-04-03 20:08:00,948] Trial 484 pruned. 
[I 2024-04-03 20:08:01,099] Trial 485 pruned. 
[I 2024-04-03 20:08:01,259] Trial 486 pruned. 
[I 2024-04-03 20:08:01,419] Trial 487 pruned. 
[I 2024-04-03 20:08:56,562] Trial 488 finished with value: 0.8229571984435797 and parameters: {'num_layers': 5, 'num_neurons': 455, 'dropout_rate': 0.12074189901206918, 'lr': 0.0005349795916572356, 'optimizer': 'Adam', 'lr_decay': 0.9999254588012172, 'activation': 'LeakyReLU'}. Best is trial 488 with value: 0.8229571984435797.
