[I 2024-04-03 18:08:10,586] Trial 117 finished with value: 0.7898832684824902 and parameters: {'num_layers': 5, 'num_neurons': 49, 'dropout_rate': 0.4757862222121365, 'lr': 0.05827648482347671, 'optimizer': 'Adam', 'lr_decay': 0.9983819879105544, 'activation': 'LeakyReLU'}. Best is trial 40 with value: 0.7976653696498055.
[I 2024-04-03 18:08:50,033] Trial 118 finished with value: 0.7821011673151751 and parameters: {'num_layers': 5, 'num_neurons': 34, 'dropout_rate': 0.48031824569769493, 'lr': 0.05844204466994384, 'optimizer': 'Adam', 'lr_decay': 0.9920882842074941, 'activation': 'ReLU'}. Best is trial 40 with value: 0.7976653696498055.
[I 2024-04-03 18:08:50,140] Trial 119 pruned. 
[I 2024-04-03 18:08:50,264] Trial 120 pruned. 
[I 2024-04-03 18:09:31,571] Trial 121 finished with value: 0.7840466926070039 and parameters: {'num_layers': 5, 'num_neurons': 73, 'dropout_rate': 0.5650314151129463, 'lr': 0.0995011658457167, 'optimizer': 'Adam', 'lr_decay': 0.9990708028058666, 'activation': 'LeakyReLU'}. Best is trial 40 with value: 0.7976653696498055.
[I 2024-04-03 18:09:31,676] Trial 122 pruned. 
[I 2024-04-03 18:09:31,755] Trial 123 pruned. 
[I 2024-04-03 18:09:31,853] Trial 124 pruned. 
[I 2024-04-03 18:09:31,960] Trial 125 pruned. 
[I 2024-04-03 18:10:00,097] Trial 126 finished with value: 0.7840466926070039 and parameters: {'num_layers': 3, 'num_neurons': 110, 'dropout_rate': 0.133210437102877, 'lr': 0.0542580853974356, 'optimizer': 'RMSprop', 'lr_decay': 0.9744112468724068, 'activation': 'LeakyReLU'}. Best is trial 40 with value: 0.7976653696498055.
[I 2024-04-03 18:10:00,193] Trial 127 pruned. 
[I 2024-04-03 18:10:00,292] Trial 128 pruned. 
[I 2024-04-03 18:10:37,541] Trial 129 finished with value: 0.7859922178988327 and parameters: {'num_layers': 4, 'num_neurons': 117, 'dropout_rate': 0.5079956818124688, 'lr': 0.023977565204634024, 'optimizer': 'Adam', 'lr_decay': 0.9966735414414367, 'activation': 'ReLU'}. Best is trial 40 with value: 0.7976653696498055.
[I 2024-04-03 18:10:37,632] Trial 130 pruned. 
[I 2024-04-03 18:10:37,806] Trial 131 pruned. 
[I 2024-04-03 18:10:37,907] Trial 132 pruned. 
[I 2024-04-03 18:11:13,500] Trial 133 finished with value: 0.7801556420233463 and parameters: {'num_layers': 4, 'num_neurons': 63, 'dropout_rate': 0.4818203638891684, 'lr': 0.021621168648822565, 'optimizer': 'Adam', 'lr_decay': 0.9970632426181504, 'activation': 'ReLU'}. Best is trial 40 with value: 0.7976653696498055.
[I 2024-04-03 18:11:51,819] Trial 134 finished with value: 0.7879377431906615 and parameters: {'num_layers': 4, 'num_neurons': 96, 'dropout_rate': 0.5383354172175592, 'lr': 0.043549213780990366, 'optimizer': 'Adam', 'lr_decay': 0.9998429748322872, 'activation': 'ReLU'}. Best is trial 40 with value: 0.7976653696498055.
[I 2024-04-03 18:12:29,640] Trial 135 finished with value: 0.7879377431906615 and parameters: {'num_layers': 4, 'num_neurons': 98, 'dropout_rate': 0.4960917069225326, 'lr': 0.04315174458381428, 'optimizer': 'Adam', 'lr_decay': 0.9994439800129543, 'activation': 'ReLU'}. Best is trial 40 with value: 0.7976653696498055.
[I 2024-04-03 18:13:06,780] Trial 136 finished with value: 0.7937743190661478 and parameters: {'num_layers': 4, 'num_neurons': 71, 'dropout_rate': 0.4917856275101957, 'lr': 0.04704217279453831, 'optimizer': 'Adam', 'lr_decay': 0.9999115446407049, 'activation': 'ReLU'}. Best is trial 40 with value: 0.7976653696498055.
[I 2024-04-03 18:13:37,797] Trial 137 finished with value: 0.7859922178988327 and parameters: {'num_layers': 3, 'num_neurons': 73, 'dropout_rate': 0.5003076107600223, 'lr': 0.04277536498390807, 'optimizer': 'Adam', 'lr_decay': 0.9992697819736113, 'activation': 'ReLU'}. Best is trial 40 with value: 0.7976653696498055.
[I 2024-04-03 18:13:37,896] Trial 138 pruned. 
[I 2024-04-03 18:14:16,124] Trial 139 finished with value: 0.791828793774319 and parameters: {'num_layers': 4, 'num_neurons': 96, 'dropout_rate': 0.492051971570146, 'lr': 0.07265728979769363, 'optimizer': 'Adam', 'lr_decay': 0.9991318986246636, 'activation': 'ReLU'}. Best is trial 40 with value: 0.7976653696498055.
[I 2024-04-03 18:14:16,224] Trial 140 pruned. 
[I 2024-04-03 18:14:16,321] Trial 141 pruned. 
[I 2024-04-03 18:14:53,576] Trial 142 finished with value: 0.7879377431906615 and parameters: {'num_layers': 4, 'num_neurons': 68, 'dropout_rate': 0.48186612531339323, 'lr': 0.08376796446669418, 'optimizer': 'Adam', 'lr_decay': 0.9989673325451643, 'activation': 'ReLU'}. Best is trial 40 with value: 0.7976653696498055.
[I 2024-04-03 18:15:30,454] Trial 143 finished with value: 0.7821011673151751 and parameters: {'num_layers': 4, 'num_neurons': 61, 'dropout_rate': 0.4625643300050711, 'lr': 0.08035472845781892, 'optimizer': 'Adam', 'lr_decay': 0.9998456527343353, 'activation': 'ReLU'}. Best is trial 40 with value: 0.7976653696498055.
[I 2024-04-03 18:16:07,258] Trial 144 finished with value: 0.7821011673151751 and parameters: {'num_layers': 4, 'num_neurons': 82, 'dropout_rate': 0.481850876984533, 'lr': 0.06462613605132651, 'optimizer': 'Adam', 'lr_decay': 0.9963577000465713, 'activation': 'ReLU'}. Best is trial 40 with value: 0.7976653696498055.
[I 2024-04-03 18:16:44,856] Trial 145 finished with value: 0.7840466926070039 and parameters: {'num_layers': 4, 'num_neurons': 95, 'dropout_rate': 0.5300764519516614, 'lr': 0.05608012707081875, 'optimizer': 'Adam', 'lr_decay': 0.9980454847088482, 'activation': 'ReLU'}. Best is trial 40 with value: 0.7976653696498055.
[I 2024-04-03 18:16:44,957] Trial 146 pruned. 
[I 2024-04-03 18:16:45,054] Trial 147 pruned. 
[I 2024-04-03 18:16:45,155] Trial 148 pruned. 
[I 2024-04-03 18:17:19,668] Trial 149 finished with value: 0.7859922178988327 and parameters: {'num_layers': 4, 'num_neurons': 32, 'dropout_rate': 0.48980897958985475, 'lr': 0.09803041858236343, 'optimizer': 'Adam', 'lr_decay': 0.9988357424400027, 'activation': 'ReLU'}. Best is trial 40 with value: 0.7976653696498055.
[I 2024-04-03 18:17:55,668] Trial 150 finished with value: 0.7782101167315175 and parameters: {'num_layers': 4, 'num_neurons': 65, 'dropout_rate': 0.5537039722900166, 'lr': 0.02607184350389205, 'optimizer': 'Adam', 'lr_decay': 0.9976813340154987, 'activation': 'ReLU'}. Best is trial 40 with value: 0.7976653696498055.
[I 2024-04-03 18:17:55,756] Trial 151 pruned. 
[I 2024-04-03 18:17:55,855] Trial 152 pruned. 
[I 2024-04-03 18:17:55,943] Trial 153 pruned. 
[I 2024-04-03 18:17:56,042] Trial 154 pruned. 
[I 2024-04-03 18:17:56,141] Trial 155 pruned. 
[I 2024-04-03 18:17:56,229] Trial 156 pruned. 
[I 2024-04-03 18:17:56,330] Trial 157 pruned. 
[I 2024-04-03 18:18:31,326] Trial 158 finished with value: 0.7782101167315175 and parameters: {'num_layers': 4, 'num_neurons': 50, 'dropout_rate': 0.5449334396625286, 'lr': 0.02922917976732953, 'optimizer': 'Adam', 'lr_decay': 0.9956969736374667, 'activation': 'ReLU'}. Best is trial 40 with value: 0.7976653696498055.
[I 2024-04-03 18:18:31,434] Trial 159 pruned. 
[I 2024-04-03 18:18:31,561] Trial 160 pruned. 
[I 2024-04-03 18:19:06,364] Trial 161 finished with value: 0.791828793774319 and parameters: {'num_layers': 4, 'num_neurons': 35, 'dropout_rate': 0.49292948634033384, 'lr': 0.06569508442341006, 'optimizer': 'Adam', 'lr_decay': 0.9990690329130668, 'activation': 'ReLU'}. Best is trial 40 with value: 0.7976653696498055.
[I 2024-04-03 18:19:41,474] Trial 162 finished with value: 0.7821011673151751 and parameters: {'num_layers': 4, 'num_neurons': 39, 'dropout_rate': 0.5028725993800246, 'lr': 0.09999588456351821, 'optimizer': 'Adam', 'lr_decay': 0.9972760587392117, 'activation': 'ReLU'}. Best is trial 40 with value: 0.7976653696498055.
[I 2024-04-03 18:20:18,198] Trial 163 finished with value: 0.7879377431906615 and parameters: {'num_layers': 4, 'num_neurons': 67, 'dropout_rate': 0.48720296679747277, 'lr': 0.04805852038118521, 'optimizer': 'Adam', 'lr_decay': 0.9998268588269629, 'activation': 'ReLU'}. Best is trial 40 with value: 0.7976653696498055.
[I 2024-04-03 18:20:54,070] Trial 164 finished with value: 0.7821011673151751 and parameters: {'num_layers': 4, 'num_neurons': 51, 'dropout_rate': 0.47857431495295233, 'lr': 0.05550671464106639, 'optimizer': 'Adam', 'lr_decay': 0.9999854306060905, 'activation': 'ReLU'}. Best is trial 40 with value: 0.7976653696498055.
[I 2024-04-03 18:21:28,567] Trial 165 finished with value: 0.7801556420233463 and parameters: {'num_layers': 4, 'num_neurons': 42, 'dropout_rate': 0.49165557796337006, 'lr': 0.062386689416036575, 'optimizer': 'Adam', 'lr_decay': 0.998075708013694, 'activation': 'LeakyReLU'}. Best is trial 40 with value: 0.7976653696498055.
[I 2024-04-03 18:21:55,554] Trial 166 finished with value: 0.7840466926070039 and parameters: {'num_layers': 4, 'num_neurons': 61, 'dropout_rate': 0.559993943004356, 'lr': 0.08121398426695307, 'optimizer': 'SGD', 'lr_decay': 0.9946829298618968, 'activation': 'ReLU'}. Best is trial 40 with value: 0.7976653696498055.
[I 2024-04-03 18:22:32,097] Trial 167 finished with value: 0.7879377431906615 and parameters: {'num_layers': 4, 'num_neurons': 95, 'dropout_rate': 0.44298700791383055, 'lr': 0.04681789053439928, 'optimizer': 'Adam', 'lr_decay': 0.9966134463149879, 'activation': 'ReLU'}. Best is trial 40 with value: 0.7976653696498055.
[I 2024-04-03 18:22:32,198] Trial 168 pruned. 
[I 2024-04-03 18:23:09,037] Trial 169 finished with value: 0.7840466926070039 and parameters: {'num_layers': 4, 'num_neurons': 67, 'dropout_rate': 0.4507305912793311, 'lr': 0.06607504789589769, 'optimizer': 'Adam', 'lr_decay': 0.9987581282999233, 'activation': 'ReLU'}. Best is trial 40 with value: 0.7976653696498055.
[I 2024-04-03 18:23:09,137] Trial 170 pruned. 
[I 2024-04-03 18:23:46,041] Trial 171 finished with value: 0.7859922178988327 and parameters: {'num_layers': 4, 'num_neurons': 110, 'dropout_rate': 0.4701747468762475, 'lr': 0.03089828230395193, 'optimizer': 'Adam', 'lr_decay': 0.9966331484631417, 'activation': 'ReLU'}. Best is trial 40 with value: 0.7976653696498055.
[I 2024-04-03 18:24:23,466] Trial 172 finished with value: 0.7859922178988327 and parameters: {'num_layers': 4, 'num_neurons': 123, 'dropout_rate': 0.5078751424431851, 'lr': 0.02394931431902943, 'optimizer': 'Adam', 'lr_decay': 0.9975155543072485, 'activation': 'ReLU'}. Best is trial 40 with value: 0.7976653696498055.
[I 2024-04-03 18:25:00,393] Trial 173 finished with value: 0.7801556420233463 and parameters: {'num_layers': 4, 'num_neurons': 98, 'dropout_rate': 0.5176382464752669, 'lr': 0.051458284244366485, 'optimizer': 'Adam', 'lr_decay': 0.9963432660224302, 'activation': 'ReLU'}. Best is trial 40 with value: 0.7976653696498055.
[I 2024-04-03 18:25:36,261] Trial 174 finished with value: 0.791828793774319 and parameters: {'num_layers': 4, 'num_neurons': 55, 'dropout_rate': 0.47867915322775056, 'lr': 0.0734512853650505, 'optimizer': 'Adam', 'lr_decay': 0.9989653491642304, 'activation': 'ReLU'}. Best is trial 40 with value: 0.7976653696498055.
[I 2024-04-03 18:26:11,606] Trial 175 finished with value: 0.791828793774319 and parameters: {'num_layers': 4, 'num_neurons': 57, 'dropout_rate': 0.4402577573399668, 'lr': 0.08382285002727997, 'optimizer': 'Adam', 'lr_decay': 0.9990528818091609, 'activation': 'LeakyReLU'}. Best is trial 40 with value: 0.7976653696498055.
[I 2024-04-03 18:26:47,786] Trial 176 finished with value: 0.7840466926070039 and parameters: {'num_layers': 4, 'num_neurons': 57, 'dropout_rate': 0.4225236712667222, 'lr': 0.08381123832749877, 'optimizer': 'Adam', 'lr_decay': 0.9988246437840418, 'activation': 'ReLU'}. Best is trial 40 with value: 0.7976653696498055.
[I 2024-04-03 18:27:22,244] Trial 177 finished with value: 0.7821011673151751 and parameters: {'num_layers': 4, 'num_neurons': 35, 'dropout_rate': 0.4413485001323685, 'lr': 0.06958876607714136, 'optimizer': 'Adam', 'lr_decay': 0.9977158623450254, 'activation': 'Sigmoid'}. Best is trial 40 with value: 0.7976653696498055.
[I 2024-04-03 18:27:57,602] Trial 178 finished with value: 0.7840466926070039 and parameters: {'num_layers': 4, 'num_neurons': 48, 'dropout_rate': 0.47510373764673963, 'lr': 0.07220717094744994, 'optimizer': 'Adam', 'lr_decay': 0.99934763105594, 'activation': 'ReLU'}. Best is trial 40 with value: 0.7976653696498055.
[I 2024-04-03 18:28:38,873] Trial 179 finished with value: 0.7879377431906615 and parameters: {'num_layers': 5, 'num_neurons': 67, 'dropout_rate': 0.46071387231451827, 'lr': 0.09104858014257786, 'optimizer': 'Adam', 'lr_decay': 0.99781662449253, 'activation': 'LeakyReLU'}. Best is trial 40 with value: 0.7976653696498055.
[I 2024-04-03 18:29:19,093] Trial 180 finished with value: 0.7821011673151751 and parameters: {'num_layers': 5, 'num_neurons': 52, 'dropout_rate': 0.461099682865841, 'lr': 0.08678007658090271, 'optimizer': 'Adam', 'lr_decay': 0.9955472647522128, 'activation': 'LeakyReLU'}. Best is trial 40 with value: 0.7976653696498055.
[I 2024-04-03 18:30:00,320] Trial 181 finished with value: 0.7821011673151751 and parameters: {'num_layers': 5, 'num_neurons': 66, 'dropout_rate': 0.48723150130602666, 'lr': 0.09842678269884368, 'optimizer': 'Adam', 'lr_decay': 0.9977420072310258, 'activation': 'LeakyReLU'}. Best is trial 40 with value: 0.7976653696498055.
[I 2024-04-03 18:30:42,049] Trial 182 finished with value: 0.7840466926070039 and parameters: {'num_layers': 5, 'num_neurons': 85, 'dropout_rate': 0.4113760720412527, 'lr': 0.06160138187942555, 'optimizer': 'Adam', 'lr_decay': 0.9999288424857882, 'activation': 'LeakyReLU'}. Best is trial 40 with value: 0.7976653696498055.
[I 2024-04-03 18:31:21,679] Trial 183 finished with value: 0.7898832684824902 and parameters: {'num_layers': 5, 'num_neurons': 42, 'dropout_rate': 0.46749442994911355, 'lr': 0.0813756597758716, 'optimizer': 'Adam', 'lr_decay': 0.9989510306803361, 'activation': 'LeakyReLU'}. Best is trial 40 with value: 0.7976653696498055.
[I 2024-04-03 18:32:02,012] Trial 184 finished with value: 0.7821011673151751 and parameters: {'num_layers': 5, 'num_neurons': 56, 'dropout_rate': 0.44247017448985915, 'lr': 0.08469372488130972, 'optimizer': 'Adam', 'lr_decay': 0.9983205862756636, 'activation': 'LeakyReLU'}. Best is trial 40 with value: 0.7976653696498055.
[I 2024-04-03 18:32:41,403] Trial 185 finished with value: 0.791828793774319 and parameters: {'num_layers': 5, 'num_neurons': 38, 'dropout_rate': 0.47396868762142963, 'lr': 0.054869762702385305, 'optimizer': 'Adam', 'lr_decay': 0.9999915934217157, 'activation': 'LeakyReLU'}. Best is trial 40 with value: 0.7976653696498055.
[I 2024-04-03 18:33:20,982] Trial 186 finished with value: 0.7840466926070039 and parameters: {'num_layers': 5, 'num_neurons': 41, 'dropout_rate': 0.45100834240661625, 'lr': 0.05562000138678314, 'optimizer': 'Adam', 'lr_decay': 0.999161311958814, 'activation': 'LeakyReLU'}. Best is trial 40 with value: 0.7976653696498055.
[I 2024-04-03 18:34:00,460] Trial 187 finished with value: 0.791828793774319 and parameters: {'num_layers': 5, 'num_neurons': 40, 'dropout_rate': 0.47571798971400053, 'lr': 0.06997173877338857, 'optimizer': 'Adam', 'lr_decay': 0.9999372156235637, 'activation': 'LeakyReLU'}. Best is trial 40 with value: 0.7976653696498055.
[I 2024-04-03 18:34:40,147] Trial 188 finished with value: 0.791828793774319 and parameters: {'num_layers': 5, 'num_neurons': 45, 'dropout_rate': 0.4731053743466368, 'lr': 0.07058151520124749, 'optimizer': 'Adam', 'lr_decay': 0.9992641473181707, 'activation': 'LeakyReLU'}. Best is trial 40 with value: 0.7976653696498055.
[I 2024-04-03 18:35:19,062] Trial 189 finished with value: 0.791828793774319 and parameters: {'num_layers': 5, 'num_neurons': 32, 'dropout_rate': 0.4719002064254094, 'lr': 0.06960726409059763, 'optimizer': 'Adam', 'lr_decay': 0.9989560574537828, 'activation': 'LeakyReLU'}. Best is trial 40 with value: 0.7976653696498055.
[I 2024-04-03 18:35:58,470] Trial 190 finished with value: 0.7821011673151751 and parameters: {'num_layers': 5, 'num_neurons': 38, 'dropout_rate': 0.4689906481085368, 'lr': 0.0714113031982625, 'optimizer': 'Adam', 'lr_decay': 0.9982329335452729, 'activation': 'LeakyReLU'}. Best is trial 40 with value: 0.7976653696498055.
[I 2024-04-03 18:36:38,000] Trial 191 finished with value: 0.7821011673151751 and parameters: {'num_layers': 5, 'num_neurons': 42, 'dropout_rate': 0.4744041168577216, 'lr': 0.07352195747789673, 'optimizer': 'Adam', 'lr_decay': 0.9999820535455356, 'activation': 'LeakyReLU'}. Best is trial 40 with value: 0.7976653696498055.
[I 2024-04-03 18:37:17,840] Trial 192 finished with value: 0.7898832684824902 and parameters: {'num_layers': 5, 'num_neurons': 47, 'dropout_rate': 0.4925438836156417, 'lr': 0.06352910033475634, 'optimizer': 'Adam', 'lr_decay': 0.9989201675479061, 'activation': 'LeakyReLU'}. Best is trial 40 with value: 0.7976653696498055.
[I 2024-04-03 18:37:57,012] Trial 193 finished with value: 0.7859922178988327 and parameters: {'num_layers': 5, 'num_neurons': 34, 'dropout_rate': 0.4926435196204705, 'lr': 0.06261752567158041, 'optimizer': 'Adam', 'lr_decay': 0.9988700841397464, 'activation': 'LeakyReLU'}. Best is trial 40 with value: 0.7976653696498055.
[I 2024-04-03 18:38:36,922] Trial 194 finished with value: 0.7840466926070039 and parameters: {'num_layers': 5, 'num_neurons': 46, 'dropout_rate': 0.47215466063077616, 'lr': 0.05486643984676672, 'optimizer': 'Adam', 'lr_decay': 0.9971915733212067, 'activation': 'LeakyReLU'}. Best is trial 40 with value: 0.7976653696498055.
[I 2024-04-03 18:39:16,123] Trial 195 finished with value: 0.7821011673151751 and parameters: {'num_layers': 5, 'num_neurons': 34, 'dropout_rate': 0.4955939674712438, 'lr': 0.09984901571899332, 'optimizer': 'Adam', 'lr_decay': 0.9984332437511446, 'activation': 'LeakyReLU'}. Best is trial 40 with value: 0.7976653696498055.
[I 2024-04-03 18:39:29,870] Trial 196 pruned. 
[I 2024-04-03 18:39:43,373] Trial 197 pruned. 
[I 2024-04-03 18:39:53,212] Trial 198 pruned. 
[I 2024-04-03 18:40:33,623] Trial 199 finished with value: 0.7859922178988327 and parameters: {'num_layers': 5, 'num_neurons': 54, 'dropout_rate': 0.47785822862112964, 'lr': 0.04344036729417149, 'optimizer': 'Adam', 'lr_decay': 0.9999589997943381, 'activation': 'LeakyReLU'}. Best is trial 40 with value: 0.7976653696498055.
[I 2024-04-03 18:40:47,170] Trial 200 pruned. 
[I 2024-04-03 18:41:27,447] Trial 201 finished with value: 0.7898832684824902 and parameters: {'num_layers': 5, 'num_neurons': 56, 'dropout_rate': 0.4803382660879763, 'lr': 0.08486486761015176, 'optimizer': 'Adam', 'lr_decay': 0.9990079671709213, 'activation': 'LeakyReLU'}. Best is trial 40 with value: 0.7976653696498055.
[I 2024-04-03 18:42:06,374] Trial 202 finished with value: 0.7859922178988327 and parameters: {'num_layers': 5, 'num_neurons': 32, 'dropout_rate': 0.45613537168698975, 'lr': 0.0826558643311567, 'optimizer': 'Adam', 'lr_decay': 0.9973759755342589, 'activation': 'LeakyReLU'}. Best is trial 40 with value: 0.7976653696498055.
[I 2024-04-03 18:42:20,210] Trial 203 pruned. 
[I 2024-04-03 18:43:00,629] Trial 204 finished with value: 0.791828793774319 and parameters: {'num_layers': 5, 'num_neurons': 57, 'dropout_rate': 0.4713658631486466, 'lr': 0.053197752386018364, 'optimizer': 'Adam', 'lr_decay': 0.9990390616454895, 'activation': 'LeakyReLU'}. Best is trial 40 with value: 0.7976653696498055.
[I 2024-04-03 18:43:41,158] Trial 205 finished with value: 0.7821011673151751 and parameters: {'num_layers': 5, 'num_neurons': 59, 'dropout_rate': 0.4683544846248877, 'lr': 0.05490861380821515, 'optimizer': 'Adam', 'lr_decay': 0.9981692870798337, 'activation': 'LeakyReLU'}. Best is trial 40 with value: 0.7976653696498055.
[I 2024-04-03 18:43:54,736] Trial 206 pruned. 
[I 2024-04-03 18:44:35,176] Trial 207 finished with value: 0.7859922178988327 and parameters: {'num_layers': 5, 'num_neurons': 57, 'dropout_rate': 0.46071322577940543, 'lr': 0.07078688127691973, 'optimizer': 'Adam', 'lr_decay': 0.9984516623037375, 'activation': 'LeakyReLU'}. Best is trial 40 with value: 0.7976653696498055.
[I 2024-04-03 18:45:15,065] Trial 208 finished with value: 0.7976653696498055 and parameters: {'num_layers': 5, 'num_neurons': 46, 'dropout_rate': 0.11986869388009233, 'lr': 0.08239650035365176, 'optimizer': 'Adam', 'lr_decay': 0.9970823867204569, 'activation': 'LeakyReLU'}. Best is trial 40 with value: 0.7976653696498055.
[I 2024-04-03 18:45:54,809] Trial 209 finished with value: 0.7898832684824902 and parameters: {'num_layers': 5, 'num_neurons': 46, 'dropout_rate': 0.12213031602934511, 'lr': 0.0815675651151487, 'optimizer': 'Adam', 'lr_decay': 0.9969673153254027, 'activation': 'LeakyReLU'}. Best is trial 40 with value: 0.7976653696498055.
[I 2024-04-03 18:46:34,323] Trial 210 finished with value: 0.791828793774319 and parameters: {'num_layers': 5, 'num_neurons': 44, 'dropout_rate': 0.12070821153906752, 'lr': 0.08114924788098263, 'optimizer': 'Adam', 'lr_decay': 0.9971085447663387, 'activation': 'LeakyReLU'}. Best is trial 40 with value: 0.7976653696498055.
[I 2024-04-03 18:47:14,043] Trial 211 finished with value: 0.791828793774319 and parameters: {'num_layers': 5, 'num_neurons': 43, 'dropout_rate': 0.1256170016526074, 'lr': 0.08134007274793856, 'optimizer': 'Adam', 'lr_decay': 0.9972204230203126, 'activation': 'LeakyReLU'}. Best is trial 40 with value: 0.7976653696498055.
[I 2024-04-03 18:47:14,152] Trial 212 pruned. 
[I 2024-04-03 18:47:14,259] Trial 213 pruned. 
[I 2024-04-03 18:47:14,368] Trial 214 pruned. 
[I 2024-04-03 18:47:54,642] Trial 215 finished with value: 0.7801556420233463 and parameters: {'num_layers': 5, 'num_neurons': 51, 'dropout_rate': 0.10488089864550121, 'lr': 0.08329937469071963, 'optimizer': 'Adam', 'lr_decay': 0.9963769433823234, 'activation': 'LeakyReLU'}. Best is trial 40 with value: 0.7976653696498055.
