[I 2024-04-03 18:48:34,161] Trial 216 finished with value: 0.791828793774319 and parameters: {'num_layers': 5, 'num_neurons': 42, 'dropout_rate': 0.15125171977676316, 'lr': 0.066097416196299, 'optimizer': 'Adam', 'lr_decay': 0.9975417174419452, 'activation': 'LeakyReLU'}. Best is trial 40 with value: 0.7976653696498055.
[I 2024-04-03 18:49:13,735] Trial 217 finished with value: 0.7840466926070039 and parameters: {'num_layers': 5, 'num_neurons': 44, 'dropout_rate': 0.15080663931533053, 'lr': 0.06332078799408049, 'optimizer': 'Adam', 'lr_decay': 0.9957202805090369, 'activation': 'LeakyReLU'}. Best is trial 40 with value: 0.7976653696498055.
[I 2024-04-03 18:49:53,181] Trial 218 finished with value: 0.7840466926070039 and parameters: {'num_layers': 5, 'num_neurons': 41, 'dropout_rate': 0.13534722737629787, 'lr': 0.07726189971726251, 'optimizer': 'Adam', 'lr_decay': 0.9947462358099786, 'activation': 'LeakyReLU'}. Best is trial 40 with value: 0.7976653696498055.
[I 2024-04-03 18:50:33,746] Trial 219 finished with value: 0.791828793774319 and parameters: {'num_layers': 5, 'num_neurons': 60, 'dropout_rate': 0.12737152834922663, 'lr': 0.05193800124703679, 'optimizer': 'Adam', 'lr_decay': 0.997556354156118, 'activation': 'LeakyReLU'}. Best is trial 40 with value: 0.7976653696498055.
[I 2024-04-03 18:50:33,856] Trial 220 pruned. 
[I 2024-04-03 18:51:12,649] Trial 221 finished with value: 0.7898832684824902 and parameters: {'num_layers': 5, 'num_neurons': 32, 'dropout_rate': 0.11939969690679271, 'lr': 0.06567080313906344, 'optimizer': 'Adam', 'lr_decay': 0.9980439499403265, 'activation': 'LeakyReLU'}. Best is trial 40 with value: 0.7976653696498055.
[I 2024-04-03 18:51:52,167] Trial 222 finished with value: 0.7879377431906615 and parameters: {'num_layers': 5, 'num_neurons': 39, 'dropout_rate': 0.11077774338923571, 'lr': 0.062673472991092, 'optimizer': 'Adam', 'lr_decay': 0.9977710800813023, 'activation': 'LeakyReLU'}. Best is trial 40 with value: 0.7976653696498055.
[I 2024-04-03 18:52:30,986] Trial 223 finished with value: 0.7859922178988327 and parameters: {'num_layers': 5, 'num_neurons': 32, 'dropout_rate': 0.16267374146882738, 'lr': 0.08472455257896382, 'optimizer': 'Adam', 'lr_decay': 0.9979530858461033, 'activation': 'LeakyReLU'}. Best is trial 40 with value: 0.7976653696498055.
[I 2024-04-03 18:53:11,204] Trial 224 finished with value: 0.7859922178988327 and parameters: {'num_layers': 5, 'num_neurons': 52, 'dropout_rate': 0.13927704794844642, 'lr': 0.05145254820752604, 'optimizer': 'Adam', 'lr_decay': 0.996402351886941, 'activation': 'LeakyReLU'}. Best is trial 40 with value: 0.7976653696498055.
[I 2024-04-03 18:53:11,313] Trial 225 pruned. 
[I 2024-04-03 18:53:51,825] Trial 226 finished with value: 0.7937743190661478 and parameters: {'num_layers': 5, 'num_neurons': 59, 'dropout_rate': 0.14854320573187688, 'lr': 0.060558934134420817, 'optimizer': 'Adam', 'lr_decay': 0.9976849178162218, 'activation': 'LeakyReLU'}. Best is trial 40 with value: 0.7976653696498055.
[I 2024-04-03 18:53:51,936] Trial 227 pruned. 
[I 2024-04-03 18:54:32,381] Trial 228 finished with value: 0.791828793774319 and parameters: {'num_layers': 5, 'num_neurons': 60, 'dropout_rate': 0.15743318440160364, 'lr': 0.08544167887979998, 'optimizer': 'Adam', 'lr_decay': 0.9989197856914932, 'activation': 'LeakyReLU'}. Best is trial 40 with value: 0.7976653696498055.
[I 2024-04-03 18:55:13,126] Trial 229 finished with value: 0.8015564202334631 and parameters: {'num_layers': 5, 'num_neurons': 61, 'dropout_rate': 0.1570840904312672, 'lr': 0.05466471734612438, 'optimizer': 'Adam', 'lr_decay': 0.9989713020747343, 'activation': 'LeakyReLU'}. Best is trial 229 with value: 0.8015564202334631.
[I 2024-04-03 18:55:13,238] Trial 230 pruned. 
[I 2024-04-03 18:55:53,624] Trial 231 finished with value: 0.7879377431906615 and parameters: {'num_layers': 5, 'num_neurons': 57, 'dropout_rate': 0.18057017360865402, 'lr': 0.05841611083785103, 'optimizer': 'Adam', 'lr_decay': 0.9990948688675106, 'activation': 'LeakyReLU'}. Best is trial 229 with value: 0.8015564202334631.
[I 2024-04-03 18:56:34,201] Trial 232 finished with value: 0.7937743190661478 and parameters: {'num_layers': 5, 'num_neurons': 61, 'dropout_rate': 0.16104752490433832, 'lr': 0.06480479867104448, 'optimizer': 'Adam', 'lr_decay': 0.9980457393205463, 'activation': 'LeakyReLU'}. Best is trial 229 with value: 0.8015564202334631.
[I 2024-04-03 18:57:15,271] Trial 233 finished with value: 0.7957198443579766 and parameters: {'num_layers': 5, 'num_neurons': 69, 'dropout_rate': 0.15038013181203444, 'lr': 0.057880725015671236, 'optimizer': 'Adam', 'lr_decay': 0.9977215882641364, 'activation': 'LeakyReLU'}. Best is trial 229 with value: 0.8015564202334631.
[I 2024-04-03 18:57:15,383] Trial 234 pruned. 
[I 2024-04-03 18:57:15,494] Trial 235 pruned. 
[I 2024-04-03 18:57:15,605] Trial 236 pruned. 
[I 2024-04-03 18:57:55,838] Trial 237 finished with value: 0.7879377431906615 and parameters: {'num_layers': 5, 'num_neurons': 54, 'dropout_rate': 0.15966845809790817, 'lr': 0.06985074856516475, 'optimizer': 'Adam', 'lr_decay': 0.9980654690402816, 'activation': 'LeakyReLU'}. Best is trial 229 with value: 0.8015564202334631.
[I 2024-04-03 18:58:35,299] Trial 238 finished with value: 0.7879377431906615 and parameters: {'num_layers': 5, 'num_neurons': 41, 'dropout_rate': 0.17566348049249675, 'lr': 0.05871920608048425, 'optimizer': 'Adam', 'lr_decay': 0.9972084066022288, 'activation': 'LeakyReLU'}. Best is trial 229 with value: 0.8015564202334631.
[I 2024-04-03 18:59:16,343] Trial 239 finished with value: 0.7957198443579766 and parameters: {'num_layers': 5, 'num_neurons': 63, 'dropout_rate': 0.1588292299191601, 'lr': 0.07290397761341827, 'optimizer': 'Adam', 'lr_decay': 0.9990953157097949, 'activation': 'LeakyReLU'}. Best is trial 229 with value: 0.8015564202334631.
[I 2024-04-03 18:59:57,955] Trial 240 finished with value: 0.7937743190661478 and parameters: {'num_layers': 5, 'num_neurons': 65, 'dropout_rate': 0.15844635674636506, 'lr': 0.04211344729905845, 'optimizer': 'Adam', 'lr_decay': 0.9982066542931874, 'activation': 'LeakyReLU'}. Best is trial 229 with value: 0.8015564202334631.
[I 2024-04-03 18:59:58,069] Trial 241 pruned. 
[I 2024-04-03 19:00:39,113] Trial 242 finished with value: 0.791828793774319 and parameters: {'num_layers': 5, 'num_neurons': 62, 'dropout_rate': 0.15341561425198252, 'lr': 0.05433260127276931, 'optimizer': 'Adam', 'lr_decay': 0.9990890067723956, 'activation': 'LeakyReLU'}. Best is trial 229 with value: 0.8015564202334631.
[I 2024-04-03 19:01:20,917] Trial 243 finished with value: 0.7879377431906615 and parameters: {'num_layers': 5, 'num_neurons': 77, 'dropout_rate': 0.15485966138119567, 'lr': 0.05614036597304816, 'optimizer': 'Adam', 'lr_decay': 0.9992346079200335, 'activation': 'LeakyReLU'}. Best is trial 229 with value: 0.8015564202334631.
[I 2024-04-03 19:01:21,029] Trial 244 pruned. 
[I 2024-04-03 19:01:21,142] Trial 245 pruned. 
[I 2024-04-03 19:01:21,257] Trial 246 pruned. 
[I 2024-04-03 19:01:21,369] Trial 247 pruned. 
[I 2024-04-03 19:02:02,009] Trial 248 finished with value: 0.7821011673151751 and parameters: {'num_layers': 5, 'num_neurons': 53, 'dropout_rate': 0.18901401040522883, 'lr': 0.07307754739570115, 'optimizer': 'Adam', 'lr_decay': 0.9961711478199811, 'activation': 'LeakyReLU'}. Best is trial 229 with value: 0.8015564202334631.
[I 2024-04-03 19:02:44,178] Trial 249 finished with value: 0.7898832684824902 and parameters: {'num_layers': 5, 'num_neurons': 77, 'dropout_rate': 0.1510351971589011, 'lr': 0.05662348109761192, 'optimizer': 'Adam', 'lr_decay': 0.9987329718084514, 'activation': 'Tanh'}. Best is trial 229 with value: 0.8015564202334631.
[I 2024-04-03 19:02:44,292] Trial 250 pruned. 
[I 2024-04-03 19:02:44,404] Trial 251 pruned. 
[I 2024-04-03 19:03:26,040] Trial 252 finished with value: 0.7898832684824902 and parameters: {'num_layers': 5, 'num_neurons': 76, 'dropout_rate': 0.16422106033441858, 'lr': 0.07004685270902175, 'optimizer': 'Adam', 'lr_decay': 0.9982507260568199, 'activation': 'LeakyReLU'}. Best is trial 229 with value: 0.8015564202334631.
[I 2024-04-03 19:04:05,886] Trial 253 finished with value: 0.7996108949416343 and parameters: {'num_layers': 5, 'num_neurons': 40, 'dropout_rate': 0.14282173282234142, 'lr': 0.04532980827722138, 'optimizer': 'Adam', 'lr_decay': 0.9999891119654983, 'activation': 'LeakyReLU'}. Best is trial 229 with value: 0.8015564202334631.
[I 2024-04-03 19:04:45,644] Trial 254 finished with value: 0.7821011673151751 and parameters: {'num_layers': 5, 'num_neurons': 40, 'dropout_rate': 0.1468028387693065, 'lr': 0.0006020785095103665, 'optimizer': 'Adam', 'lr_decay': 0.9990565190345988, 'activation': 'LeakyReLU'}. Best is trial 229 with value: 0.8015564202334631.
[I 2024-04-03 19:04:45,756] Trial 255 pruned. 
[I 2024-04-03 19:05:25,018] Trial 256 finished with value: 0.7957198443579766 and parameters: {'num_layers': 5, 'num_neurons': 32, 'dropout_rate': 0.12880489364909564, 'lr': 0.07181272869169225, 'optimizer': 'Adam', 'lr_decay': 0.9992273519286106, 'activation': 'LeakyReLU'}. Best is trial 229 with value: 0.8015564202334631.
[I 2024-04-03 19:05:31,549] Trial 257 pruned. 
[I 2024-04-03 19:06:01,108] Trial 258 finished with value: 0.7859922178988327 and parameters: {'num_layers': 5, 'num_neurons': 40, 'dropout_rate': 0.11044481272832246, 'lr': 0.07593940010233782, 'optimizer': 'SGD', 'lr_decay': 0.997671570150121, 'activation': 'LeakyReLU'}. Best is trial 229 with value: 0.8015564202334631.
[I 2024-04-03 19:06:40,806] Trial 259 finished with value: 0.7957198443579766 and parameters: {'num_layers': 5, 'num_neurons': 40, 'dropout_rate': 0.14072136780359665, 'lr': 0.06805673992132415, 'optimizer': 'Adam', 'lr_decay': 0.9963894841945643, 'activation': 'LeakyReLU'}. Best is trial 229 with value: 0.8015564202334631.
[I 2024-04-03 19:07:20,615] Trial 260 finished with value: 0.7840466926070039 and parameters: {'num_layers': 5, 'num_neurons': 39, 'dropout_rate': 0.12433064654144733, 'lr': 0.06642375539743513, 'optimizer': 'Adam', 'lr_decay': 0.9961269814552888, 'activation': 'LeakyReLU'}. Best is trial 229 with value: 0.8015564202334631.
[I 2024-04-03 19:07:20,725] Trial 261 pruned. 
[I 2024-04-03 19:07:20,836] Trial 262 pruned. 
[I 2024-04-03 19:07:20,949] Trial 263 pruned. 
[I 2024-04-03 19:08:00,655] Trial 264 finished with value: 0.7879377431906615 and parameters: {'num_layers': 5, 'num_neurons': 40, 'dropout_rate': 0.1416307676094736, 'lr': 0.07601195940288273, 'optimizer': 'Adam', 'lr_decay': 0.9999499027026211, 'activation': 'LeakyReLU'}. Best is trial 229 with value: 0.8015564202334631.
[I 2024-04-03 19:08:41,197] Trial 265 finished with value: 0.7937743190661478 and parameters: {'num_layers': 5, 'num_neurons': 51, 'dropout_rate': 0.14386284095371302, 'lr': 0.059599150151670166, 'optimizer': 'Adam', 'lr_decay': 0.9964549532958569, 'activation': 'LeakyReLU'}. Best is trial 229 with value: 0.8015564202334631.
[I 2024-04-03 19:08:41,307] Trial 266 pruned. 
[I 2024-04-03 19:09:21,673] Trial 267 finished with value: 0.7840466926070039 and parameters: {'num_layers': 5, 'num_neurons': 49, 'dropout_rate': 0.16363249316675388, 'lr': 0.0835661745140107, 'optimizer': 'Adam', 'lr_decay': 0.9953342431519743, 'activation': 'LeakyReLU'}. Best is trial 229 with value: 0.8015564202334631.
[I 2024-04-03 19:09:21,784] Trial 268 pruned. 
[I 2024-04-03 19:09:21,897] Trial 269 pruned. 
[I 2024-04-03 19:09:22,008] Trial 270 pruned. 
[I 2024-04-03 19:10:02,522] Trial 271 finished with value: 0.7821011673151751 and parameters: {'num_layers': 5, 'num_neurons': 52, 'dropout_rate': 0.26367053486175573, 'lr': 0.03502587033984393, 'optimizer': 'Adam', 'lr_decay': 0.993207286307581, 'activation': 'LeakyReLU'}. Best is trial 229 with value: 0.8015564202334631.
[I 2024-04-03 19:10:41,699] Trial 272 finished with value: 0.7821011673151751 and parameters: {'num_layers': 5, 'num_neurons': 32, 'dropout_rate': 0.18364370349360218, 'lr': 0.05044415435084129, 'optimizer': 'Adam', 'lr_decay': 0.9942881063722302, 'activation': 'LeakyReLU'}. Best is trial 229 with value: 0.8015564202334631.
[I 2024-04-03 19:10:41,810] Trial 273 pruned. 
[I 2024-04-03 19:10:41,924] Trial 274 pruned. 
[I 2024-04-03 19:10:42,037] Trial 275 pruned. 
[I 2024-04-03 19:10:42,148] Trial 276 pruned. 
[I 2024-04-03 19:10:42,260] Trial 277 pruned. 
[I 2024-04-03 19:11:20,776] Trial 278 finished with value: 0.7957198443579766 and parameters: {'num_layers': 5, 'num_neurons': 349, 'dropout_rate': 0.1172406985047472, 'lr': 0.05261302798187259, 'optimizer': 'SGD', 'lr_decay': 0.9973415744507803, 'activation': 'LeakyReLU'}. Best is trial 229 with value: 0.8015564202334631.
[I 2024-04-03 19:11:52,038] Trial 279 finished with value: 0.7801556420233463 and parameters: {'num_layers': 5, 'num_neurons': 73, 'dropout_rate': 0.11958646891387933, 'lr': 0.04952513673481737, 'optimizer': 'SGD', 'lr_decay': 0.9981288321671137, 'activation': 'LeakyReLU'}. Best is trial 229 with value: 0.8015564202334631.
[I 2024-04-03 19:11:52,151] Trial 280 pruned. 
[I 2024-04-03 19:11:56,984] Trial 281 pruned. 
[I 2024-04-03 19:11:57,079] Trial 282 pruned. 
[I 2024-04-03 19:12:35,106] Trial 283 finished with value: 0.7879377431906615 and parameters: {'num_layers': 5, 'num_neurons': 337, 'dropout_rate': 0.23345517587070352, 'lr': 0.08729313554325595, 'optimizer': 'SGD', 'lr_decay': 0.9988157622475483, 'activation': 'LeakyReLU'}. Best is trial 229 with value: 0.8015564202334631.
[I 2024-04-03 19:12:35,251] Trial 284 pruned. 
[I 2024-04-03 19:13:28,117] Trial 285 finished with value: 0.7840466926070039 and parameters: {'num_layers': 5, 'num_neurons': 375, 'dropout_rate': 0.50683447469099, 'lr': 0.07701292457766458, 'optimizer': 'Adam', 'lr_decay': 0.9972292280293351, 'activation': 'LeakyReLU'}. Best is trial 229 with value: 0.8015564202334631.
[I 2024-04-03 19:14:08,724] Trial 286 finished with value: 0.7840466926070039 and parameters: {'num_layers': 5, 'num_neurons': 52, 'dropout_rate': 0.4768850229285629, 'lr': 0.05774600842633044, 'optimizer': 'Adam', 'lr_decay': 0.9981457515142187, 'activation': 'LeakyReLU'}. Best is trial 229 with value: 0.8015564202334631.
[I 2024-04-03 19:14:08,878] Trial 287 pruned. 
[I 2024-04-03 19:14:49,863] Trial 288 finished with value: 0.7937743190661478 and parameters: {'num_layers': 5, 'num_neurons': 61, 'dropout_rate': 0.3998331411960743, 'lr': 0.09759422406025499, 'optimizer': 'Adam', 'lr_decay': 0.999140423629531, 'activation': 'LeakyReLU'}. Best is trial 229 with value: 0.8015564202334631.
[I 2024-04-03 19:14:49,980] Trial 289 pruned. 
[I 2024-04-03 19:14:50,118] Trial 290 pruned. 
[I 2024-04-03 19:14:50,226] Trial 291 pruned. 
[I 2024-04-03 19:15:31,822] Trial 292 finished with value: 0.7898832684824902 and parameters: {'num_layers': 5, 'num_neurons': 66, 'dropout_rate': 0.36904819929652655, 'lr': 0.046124982313926394, 'optimizer': 'Adam', 'lr_decay': 0.9991700217172103, 'activation': 'LeakyReLU'}. Best is trial 229 with value: 0.8015564202334631.
[I 2024-04-03 19:16:12,617] Trial 293 finished with value: 0.7801556420233463 and parameters: {'num_layers': 5, 'num_neurons': 56, 'dropout_rate': 0.4474252355312122, 'lr': 0.07472889259299259, 'optimizer': 'Adam', 'lr_decay': 0.9978821872276666, 'activation': 'LeakyReLU'}. Best is trial 229 with value: 0.8015564202334631.
[I 2024-04-03 19:16:12,757] Trial 294 pruned. 
[I 2024-04-03 19:16:54,371] Trial 295 finished with value: 0.7859922178988327 and parameters: {'num_layers': 5, 'num_neurons': 76, 'dropout_rate': 0.48582134363546214, 'lr': 0.09771047609423548, 'optimizer': 'Adam', 'lr_decay': 0.9982709976502464, 'activation': 'LeakyReLU'}. Best is trial 229 with value: 0.8015564202334631.
[I 2024-04-03 19:17:35,388] Trial 296 finished with value: 0.7937743190661478 and parameters: {'num_layers': 5, 'num_neurons': 62, 'dropout_rate': 0.21145127013467882, 'lr': 0.036840023927879946, 'optimizer': 'Adam', 'lr_decay': 0.9992274472090279, 'activation': 'LeakyReLU'}. Best is trial 229 with value: 0.8015564202334631.
[I 2024-04-03 19:18:16,512] Trial 297 finished with value: 0.8073929961089494 and parameters: {'num_layers': 5, 'num_neurons': 64, 'dropout_rate': 0.16899321286675797, 'lr': 0.03107100893352588, 'optimizer': 'Adam', 'lr_decay': 0.99989896551815, 'activation': 'LeakyReLU'}. Best is trial 297 with value: 0.8073929961089494.
[I 2024-04-03 19:18:57,961] Trial 298 finished with value: 0.8015564202334631 and parameters: {'num_layers': 5, 'num_neurons': 68, 'dropout_rate': 0.216518768330158, 'lr': 0.032787840071978006, 'optimizer': 'Adam', 'lr_decay': 0.9996708186052915, 'activation': 'LeakyReLU'}. Best is trial 297 with value: 0.8073929961089494.
[I 2024-04-03 19:18:58,078] Trial 299 pruned. 
[I 2024-04-03 19:18:58,195] Trial 300 pruned. 
[I 2024-04-03 19:18:58,312] Trial 301 pruned. 
[I 2024-04-03 19:18:58,428] Trial 302 pruned. 
[I 2024-04-03 19:18:58,543] Trial 303 pruned. 
[I 2024-04-03 19:19:30,023] Trial 304 finished with value: 0.7840466926070039 and parameters: {'num_layers': 5, 'num_neurons': 87, 'dropout_rate': 0.18617995486349176, 'lr': 0.03466093319747508, 'optimizer': 'SGD', 'lr_decay': 0.9985090246412275, 'activation': 'LeakyReLU'}. Best is trial 297 with value: 0.8073929961089494.
[I 2024-04-03 19:19:30,140] Trial 305 pruned. 
[I 2024-04-03 19:20:10,872] Trial 306 finished with value: 0.7898832684824902 and parameters: {'num_layers': 5, 'num_neurons': 56, 'dropout_rate': 0.16559734972217838, 'lr': 0.030911360663304657, 'optimizer': 'Adam', 'lr_decay': 0.9992292413903374, 'activation': 'LeakyReLU'}. Best is trial 297 with value: 0.8073929961089494.
[I 2024-04-03 19:20:11,035] Trial 307 pruned. 
[I 2024-04-03 19:20:11,154] Trial 308 pruned. 
[I 2024-04-03 19:20:11,271] Trial 309 pruned. 
[I 2024-04-03 19:20:52,234] Trial 310 finished with value: 0.7821011673151751 and parameters: {'num_layers': 5, 'num_neurons': 62, 'dropout_rate': 0.2786676990906742, 'lr': 0.0011665568874963787, 'optimizer': 'Adam', 'lr_decay': 0.9982302590972078, 'activation': 'LeakyReLU'}. Best is trial 297 with value: 0.8073929961089494.
[I 2024-04-03 19:21:32,820] Trial 311 finished with value: 0.7976653696498055 and parameters: {'num_layers': 5, 'num_neurons': 51, 'dropout_rate': 0.1775108491927382, 'lr': 0.05062630854092136, 'optimizer': 'Adam', 'lr_decay': 0.9990348981206443, 'activation': 'LeakyReLU'}. Best is trial 297 with value: 0.8073929961089494.
[I 2024-04-03 19:21:32,940] Trial 312 pruned. 
[I 2024-04-03 19:22:13,722] Trial 313 finished with value: 0.791828793774319 and parameters: {'num_layers': 5, 'num_neurons': 57, 'dropout_rate': 0.1588987445457391, 'lr': 0.05184298717872031, 'optimizer': 'Adam', 'lr_decay': 0.9974796918434484, 'activation': 'LeakyReLU'}. Best is trial 297 with value: 0.8073929961089494.
[I 2024-04-03 19:22:13,860] Trial 314 pruned. 
[I 2024-04-03 19:22:13,976] Trial 315 pruned. 
[I 2024-04-03 19:22:14,091] Trial 316 pruned. 
[I 2024-04-03 19:22:18,410] Trial 317 pruned. 
[I 2024-04-03 19:23:11,001] Trial 318 finished with value: 0.7723735408560312 and parameters: {'num_layers': 5, 'num_neurons': 236, 'dropout_rate': 0.14517131208360357, 'lr': 0.06155288269766992, 'optimizer': 'Adam', 'lr_decay': 0.9891554626960838, 'activation': 'LeakyReLU'}. Best is trial 297 with value: 0.8073929961089494.
[I 2024-04-03 19:24:02,503] Trial 319 finished with value: 0.7957198443579766 and parameters: {'num_layers': 5, 'num_neurons': 319, 'dropout_rate': 0.20250240527739127, 'lr': 0.0409185561230843, 'optimizer': 'Adam', 'lr_decay': 0.9986208866466989, 'activation': 'LeakyReLU'}. Best is trial 297 with value: 0.8073929961089494.
[I 2024-04-03 19:24:02,645] Trial 320 pruned. 
[I 2024-04-03 19:24:02,785] Trial 321 pruned. 
[I 2024-04-03 19:24:02,904] Trial 322 pruned. 
[I 2024-04-03 19:24:03,047] Trial 323 pruned. 
[I 2024-04-03 19:24:03,188] Trial 324 pruned. 
[I 2024-04-03 19:24:03,330] Trial 325 pruned. 
[I 2024-04-03 19:24:03,474] Trial 326 pruned. 
[I 2024-04-03 19:24:03,622] Trial 327 pruned. 
[I 2024-04-03 19:24:03,744] Trial 328 pruned. 
[I 2024-04-03 19:24:56,402] Trial 329 finished with value: 0.7937743190661478 and parameters: {'num_layers': 5, 'num_neurons': 365, 'dropout_rate': 0.2416494607986801, 'lr': 0.02840011700551697, 'optimizer': 'Adam', 'lr_decay': 0.9982214019484243, 'activation': 'LeakyReLU'}. Best is trial 297 with value: 0.8073929961089494.
[I 2024-04-03 19:24:56,519] Trial 330 pruned. 
[I 2024-04-03 19:24:56,661] Trial 331 pruned. 
[I 2024-04-03 19:24:56,806] Trial 332 pruned. 
[I 2024-04-03 19:24:56,945] Trial 333 pruned. 
[I 2024-04-03 19:24:57,097] Trial 334 pruned. 
[I 2024-04-03 19:24:57,240] Trial 335 pruned. 
[I 2024-04-03 19:24:57,388] Trial 336 pruned. 
[I 2024-04-03 19:24:57,531] Trial 337 pruned. 
[I 2024-04-03 19:25:38,539] Trial 338 finished with value: 0.7898832684824902 and parameters: {'num_layers': 5, 'num_neurons': 64, 'dropout_rate': 0.1408205478982922, 'lr': 0.08793107353768409, 'optimizer': 'Adam', 'lr_decay': 0.9990048185150145, 'activation': 'LeakyReLU'}. Best is trial 297 with value: 0.8073929961089494.
[I 2024-04-03 19:26:20,479] Trial 339 finished with value: 0.7801556420233463 and parameters: {'num_layers': 5, 'num_neurons': 76, 'dropout_rate': 0.16505444850536852, 'lr': 0.03669487108953299, 'optimizer': 'Adam', 'lr_decay': 0.9951379827318517, 'activation': 'Tanh'}. Best is trial 297 with value: 0.8073929961089494.
[I 2024-04-03 19:26:20,597] Trial 340 pruned. 
[I 2024-04-03 19:26:20,712] Trial 341 pruned. 
[I 2024-04-03 19:26:57,136] Trial 342 finished with value: 0.7957198443579766 and parameters: {'num_layers': 4, 'num_neurons': 88, 'dropout_rate': 0.15356686510970577, 'lr': 0.07188027770872878, 'optimizer': 'Adam', 'lr_decay': 0.9966184783852745, 'activation': 'LeakyReLU'}. Best is trial 297 with value: 0.8073929961089494.
