Running SLURM prolog script on rose02.cluster.local
===============================================================================
Job started on Wed Apr  3 17:38:52 BST 2024
Job ID          : 5768521
Job name        : lauch.sh
WorkDir         : /mainfs/lyceum/jhj1g23/Deep-Learning-Learning/uavsvm
Command         : /mainfs/lyceum/jhj1g23/Deep-Learning-Learning/uavsvm/lauch.sh
Partition       : a100
Num hosts       : 1
Num cores       : 48
Num of tasks    : 1
Hosts allocated : rose02
Job Output Follows ...
===============================================================================
[I 2024-04-03 17:39:44,847] A new study created in memory with name: no-name-3d2710cc-6064-466f-af42-d4a2de7c15be
[I 2024-04-03 17:40:34,227] Trial 0 finished with value: 0.7840466926070039 and parameters: {'num_layers': 3, 'num_neurons': 254, 'dropout_rate': 0.17993683356595574, 'lr': 0.00024508939919397034, 'optimizer': 'RMSprop', 'lr_decay': 0.990237433476786, 'activation': 'ReLU'}. Best is trial 0 with value: 0.7840466926070039.
[I 2024-04-03 17:40:58,567] Trial 1 finished with value: 0.7821011673151751 and parameters: {'num_layers': 2, 'num_neurons': 209, 'dropout_rate': 0.38739335920394813, 'lr': 0.031240005772419976, 'optimizer': 'RMSprop', 'lr_decay': 0.9583890298811898, 'activation': 'LeakyReLU'}. Best is trial 0 with value: 0.7840466926070039.
[I 2024-04-03 17:41:26,106] Trial 2 finished with value: 0.7821011673151751 and parameters: {'num_layers': 3, 'num_neurons': 103, 'dropout_rate': 0.5425310290830613, 'lr': 0.009261067884686355, 'optimizer': 'RMSprop', 'lr_decay': 0.9961620269485576, 'activation': 'Sigmoid'}. Best is trial 0 with value: 0.7840466926070039.
[I 2024-04-03 17:41:43,945] Trial 3 finished with value: 0.7723735408560312 and parameters: {'num_layers': 1, 'num_neurons': 76, 'dropout_rate': 0.17571945738565187, 'lr': 0.0699798294299549, 'optimizer': 'RMSprop', 'lr_decay': 0.9610691209910782, 'activation': 'ELU'}. Best is trial 0 with value: 0.7840466926070039.
[I 2024-04-03 17:42:09,973] Trial 4 finished with value: 0.6381322957198443 and parameters: {'num_layers': 3, 'num_neurons': 222, 'dropout_rate': 0.20378814972177006, 'lr': 0.00482267870832823, 'optimizer': 'SGD', 'lr_decay': 0.9638082855567774, 'activation': 'Tanh'}. Best is trial 0 with value: 0.7840466926070039.
[I 2024-04-03 17:42:10,050] Trial 5 pruned. 
[I 2024-04-03 17:42:28,038] Trial 6 finished with value: 0.7821011673151751 and parameters: {'num_layers': 1, 'num_neurons': 69, 'dropout_rate': 0.5783954012028315, 'lr': 0.0003591075602168562, 'optimizer': 'RMSprop', 'lr_decay': 0.9680782399534456, 'activation': 'Sigmoid'}. Best is trial 0 with value: 0.7840466926070039.
[I 2024-04-03 17:42:28,142] Trial 7 pruned. 
[I 2024-04-03 17:42:46,192] Trial 8 finished with value: 0.7801556420233463 and parameters: {'num_layers': 1, 'num_neurons': 91, 'dropout_rate': 0.25097124414175986, 'lr': 0.0010919533432966764, 'optimizer': 'RMSprop', 'lr_decay': 0.9920101907166149, 'activation': 'ReLU'}. Best is trial 0 with value: 0.7840466926070039.
[I 2024-04-03 17:42:46,251] Trial 9 pruned. 
[I 2024-04-03 17:42:46,384] Trial 10 pruned. 
[I 2024-04-03 17:42:46,521] Trial 11 pruned. 
[I 2024-04-03 17:43:12,616] Trial 12 finished with value: 0.7782101167315175 and parameters: {'num_layers': 2, 'num_neurons': 336, 'dropout_rate': 0.4497170656421399, 'lr': 0.009980718535680463, 'optimizer': 'RMSprop', 'lr_decay': 0.9800422873219036, 'activation': 'LeakyReLU'}. Best is trial 0 with value: 0.7840466926070039.
[I 2024-04-03 17:43:12,687] Trial 13 pruned. 
[I 2024-04-03 17:43:12,773] Trial 14 pruned. 
[I 2024-04-03 17:43:12,847] Trial 15 pruned. 
[I 2024-04-03 17:43:12,933] Trial 16 pruned. 
[I 2024-04-03 17:43:13,004] Trial 17 pruned. 
[I 2024-04-03 17:43:13,077] Trial 18 pruned. 
[I 2024-04-03 17:43:13,176] Trial 19 pruned. 
[I 2024-04-03 17:43:40,588] Trial 20 finished with value: 0.7762645914396887 and parameters: {'num_layers': 2, 'num_neurons': 382, 'dropout_rate': 0.13598383747940013, 'lr': 0.002573417045181149, 'optimizer': 'RMSprop', 'lr_decay': 0.9781772533208137, 'activation': 'Sigmoid'}. Best is trial 0 with value: 0.7840466926070039.
[I 2024-04-03 17:43:40,673] Trial 21 pruned. 
[I 2024-04-03 17:44:06,960] Trial 22 finished with value: 0.7821011673151751 and parameters: {'num_layers': 3, 'num_neurons': 34, 'dropout_rate': 0.6139265844377307, 'lr': 0.08749177936463039, 'optimizer': 'RMSprop', 'lr_decay': 0.9949482627674638, 'activation': 'Sigmoid'}. Best is trial 0 with value: 0.7840466926070039.
[I 2024-04-03 17:44:35,899] Trial 23 finished with value: 0.7821011673151751 and parameters: {'num_layers': 3, 'num_neurons': 121, 'dropout_rate': 0.6665583498750477, 'lr': 0.006734944431728289, 'optimizer': 'RMSprop', 'lr_decay': 0.9879861746985432, 'activation': 'Sigmoid'}. Best is trial 0 with value: 0.7840466926070039.
[I 2024-04-03 17:44:35,991] Trial 24 pruned. 
[I 2024-04-03 17:45:01,960] Trial 25 finished with value: 0.7782101167315175 and parameters: {'num_layers': 2, 'num_neurons': 299, 'dropout_rate': 0.40610987839787777, 'lr': 0.0005303873243813077, 'optimizer': 'RMSprop', 'lr_decay': 0.996837118251857, 'activation': 'Sigmoid'}. Best is trial 0 with value: 0.7840466926070039.
[I 2024-04-03 17:45:02,037] Trial 26 pruned. 
[I 2024-04-03 17:45:02,120] Trial 27 pruned. 
[I 2024-04-03 17:45:02,180] Trial 28 pruned. 
[I 2024-04-03 17:45:02,231] Trial 29 pruned. 
[I 2024-04-03 17:45:28,088] Trial 30 finished with value: 0.7723735408560312 and parameters: {'num_layers': 2, 'num_neurons': 289, 'dropout_rate': 0.2983974994717064, 'lr': 0.0001652746034615461, 'optimizer': 'RMSprop', 'lr_decay': 0.9676072753536357, 'activation': 'Sigmoid'}. Best is trial 0 with value: 0.7840466926070039.
[I 2024-04-03 17:45:46,126] Trial 31 finished with value: 0.7821011673151751 and parameters: {'num_layers': 1, 'num_neurons': 75, 'dropout_rate': 0.5895336855151581, 'lr': 0.0002421376223089563, 'optimizer': 'RMSprop', 'lr_decay': 0.9599368046734519, 'activation': 'Sigmoid'}. Best is trial 0 with value: 0.7840466926070039.
[I 2024-04-03 17:45:46,182] Trial 32 pruned. 
[I 2024-04-03 17:45:46,238] Trial 33 pruned. 
[I 2024-04-03 17:46:15,644] Trial 34 finished with value: 0.7821011673151751 and parameters: {'num_layers': 3, 'num_neurons': 149, 'dropout_rate': 0.5362187330432706, 'lr': 0.000369827461926812, 'optimizer': 'RMSprop', 'lr_decay': 0.9660482489509976, 'activation': 'Sigmoid'}. Best is trial 0 with value: 0.7840466926070039.
[I 2024-04-03 17:46:15,710] Trial 35 pruned. 
[I 2024-04-03 17:46:33,559] Trial 36 finished with value: 0.7821011673151751 and parameters: {'num_layers': 1, 'num_neurons': 51, 'dropout_rate': 0.1886646720957209, 'lr': 0.051451154627834596, 'optimizer': 'RMSprop', 'lr_decay': 0.9972452909060195, 'activation': 'Sigmoid'}. Best is trial 0 with value: 0.7840466926070039.
[I 2024-04-03 17:46:33,645] Trial 37 pruned. 
[I 2024-04-03 17:46:33,722] Trial 38 pruned. 
[I 2024-04-03 17:47:08,938] Trial 39 finished with value: 0.7840466926070039 and parameters: {'num_layers': 4, 'num_neurons': 181, 'dropout_rate': 0.14612445657515108, 'lr': 0.000742808623693304, 'optimizer': 'RMSprop', 'lr_decay': 0.953977131284526, 'activation': 'ReLU'}. Best is trial 0 with value: 0.7840466926070039.
[I 2024-04-03 17:47:43,910] Trial 40 finished with value: 0.7976653696498055 and parameters: {'num_layers': 4, 'num_neurons': 174, 'dropout_rate': 0.1572433403899416, 'lr': 0.0006655903959267996, 'optimizer': 'RMSprop', 'lr_decay': 0.9524502069225788, 'activation': 'ReLU'}. Best is trial 40 with value: 0.7976653696498055.
[I 2024-04-03 17:47:44,003] Trial 41 pruned. 
[I 2024-04-03 17:47:44,099] Trial 42 pruned. 
[I 2024-04-03 17:48:25,646] Trial 43 finished with value: 0.7762645914396887 and parameters: {'num_layers': 5, 'num_neurons': 193, 'dropout_rate': 0.10452896360840955, 'lr': 0.00028015618390045833, 'optimizer': 'RMSprop', 'lr_decay': 0.9544961547014774, 'activation': 'ReLU'}. Best is trial 40 with value: 0.7976653696498055.
[I 2024-04-03 17:48:25,736] Trial 44 pruned. 
[I 2024-04-03 17:48:56,475] Trial 45 finished with value: 0.7879377431906615 and parameters: {'num_layers': 3, 'num_neurons': 211, 'dropout_rate': 0.11825083715650525, 'lr': 0.004063652995892813, 'optimizer': 'RMSprop', 'lr_decay': 0.9595673132841328, 'activation': 'ReLU'}. Best is trial 40 with value: 0.7976653696498055.
[I 2024-04-03 17:48:56,570] Trial 46 pruned. 
[I 2024-04-03 17:49:40,943] Trial 47 finished with value: 0.7782101167315175 and parameters: {'num_layers': 5, 'num_neurons': 253, 'dropout_rate': 0.21676776075645823, 'lr': 0.0005745893454309639, 'optimizer': 'RMSprop', 'lr_decay': 0.9583778578438465, 'activation': 'ReLU'}. Best is trial 40 with value: 0.7976653696498055.
[I 2024-04-03 17:49:41,014] Trial 48 pruned. 
[I 2024-04-03 17:49:41,123] Trial 49 pruned. 
[I 2024-04-03 17:49:41,217] Trial 50 pruned. 
[I 2024-04-03 17:50:10,720] Trial 51 finished with value: 0.7821011673151751 and parameters: {'num_layers': 3, 'num_neurons': 170, 'dropout_rate': 0.1580679932401221, 'lr': 0.016955867385545526, 'optimizer': 'RMSprop', 'lr_decay': 0.9591446867330337, 'activation': 'ReLU'}. Best is trial 40 with value: 0.7976653696498055.
[I 2024-04-03 17:50:40,889] Trial 52 finished with value: 0.7821011673151751 and parameters: {'num_layers': 3, 'num_neurons': 195, 'dropout_rate': 0.19311280954699558, 'lr': 0.008491030795366958, 'optimizer': 'RMSprop', 'lr_decay': 0.9501109404003134, 'activation': 'LeakyReLU'}. Best is trial 40 with value: 0.7976653696498055.
[I 2024-04-03 17:51:11,797] Trial 53 finished with value: 0.7801556420233463 and parameters: {'num_layers': 3, 'num_neurons': 232, 'dropout_rate': 0.24943546183044685, 'lr': 0.0038019568257947915, 'optimizer': 'RMSprop', 'lr_decay': 0.9527159026431856, 'activation': 'ReLU'}. Best is trial 40 with value: 0.7976653696498055.
[I 2024-04-03 17:51:45,395] Trial 54 finished with value: 0.7840466926070039 and parameters: {'num_layers': 4, 'num_neurons': 118, 'dropout_rate': 0.10169644538213796, 'lr': 0.014932486558075848, 'optimizer': 'RMSprop', 'lr_decay': 0.9814223691696511, 'activation': 'ReLU'}. Best is trial 40 with value: 0.7976653696498055.
[I 2024-04-03 17:51:45,499] Trial 55 pruned. 
[I 2024-04-03 17:51:45,588] Trial 56 pruned. 
[I 2024-04-03 17:52:28,266] Trial 57 finished with value: 0.7762645914396887 and parameters: {'num_layers': 5, 'num_neurons': 176, 'dropout_rate': 0.12986214361854043, 'lr': 0.02676039177449507, 'optimizer': 'RMSprop', 'lr_decay': 0.9906499010247805, 'activation': 'ReLU'}. Best is trial 40 with value: 0.7976653696498055.
[I 2024-04-03 17:52:28,353] Trial 58 pruned. 
[I 2024-04-03 17:52:28,452] Trial 59 pruned. 
[I 2024-04-03 17:52:28,571] Trial 60 pruned. 
[I 2024-04-03 17:52:28,650] Trial 61 pruned. 
[I 2024-04-03 17:53:00,003] Trial 62 finished with value: 0.7801556420233463 and parameters: {'num_layers': 3, 'num_neurons': 265, 'dropout_rate': 0.22467740616829943, 'lr': 0.0002849850312786441, 'optimizer': 'RMSprop', 'lr_decay': 0.9926655656473516, 'activation': 'ReLU'}. Best is trial 40 with value: 0.7976653696498055.
[I 2024-04-03 17:53:00,083] Trial 63 pruned. 
[I 2024-04-03 17:53:32,853] Trial 64 finished with value: 0.7821011673151751 and parameters: {'num_layers': 3, 'num_neurons': 243, 'dropout_rate': 0.12644290922575718, 'lr': 0.008275449369919884, 'optimizer': 'RMSprop', 'lr_decay': 0.9878915337170439, 'activation': 'ReLU'}. Best is trial 40 with value: 0.7976653696498055.
[I 2024-04-03 17:53:32,936] Trial 65 pruned. 
[I 2024-04-03 17:53:33,005] Trial 66 pruned. 
[I 2024-04-03 17:53:33,096] Trial 67 pruned. 
[I 2024-04-03 17:53:33,178] Trial 68 pruned. 
[I 2024-04-03 17:53:33,287] Trial 69 pruned. 
[I 2024-04-03 17:53:33,350] Trial 70 pruned. 
[I 2024-04-03 17:53:56,716] Trial 71 finished with value: 0.7821011673151751 and parameters: {'num_layers': 2, 'num_neurons': 112, 'dropout_rate': 0.5798796330019315, 'lr': 9.928377199562299e-05, 'optimizer': 'RMSprop', 'lr_decay': 0.9679087277256055, 'activation': 'Sigmoid'}. Best is trial 40 with value: 0.7976653696498055.
[I 2024-04-03 17:54:14,935] Trial 72 finished with value: 0.7821011673151751 and parameters: {'num_layers': 1, 'num_neurons': 89, 'dropout_rate': 0.6978404206797537, 'lr': 0.000348010971500812, 'optimizer': 'RMSprop', 'lr_decay': 0.9561092865918475, 'activation': 'Sigmoid'}. Best is trial 40 with value: 0.7976653696498055.
[I 2024-04-03 17:54:37,667] Trial 73 finished with value: 0.7821011673151751 and parameters: {'num_layers': 2, 'num_neurons': 66, 'dropout_rate': 0.6366375265066962, 'lr': 0.00013436069271299797, 'optimizer': 'RMSprop', 'lr_decay': 0.9699185602558029, 'activation': 'Sigmoid'}. Best is trial 40 with value: 0.7976653696498055.
[I 2024-04-03 17:55:08,992] Trial 74 finished with value: 0.7762645914396887 and parameters: {'num_layers': 3, 'num_neurons': 223, 'dropout_rate': 0.5542246373127806, 'lr': 0.0006627030039425958, 'optimizer': 'RMSprop', 'lr_decay': 0.9655317571924109, 'activation': 'Sigmoid'}. Best is trial 40 with value: 0.7976653696498055.
[I 2024-04-03 17:55:29,188] Trial 75 finished with value: 0.7782101167315175 and parameters: {'num_layers': 1, 'num_neurons': 205, 'dropout_rate': 0.5188145027169052, 'lr': 0.0004218506978498278, 'optimizer': 'Adam', 'lr_decay': 0.9984412198098559, 'activation': 'ReLU'}. Best is trial 40 with value: 0.7976653696498055.
[I 2024-04-03 17:55:29,279] Trial 76 pruned. 
[I 2024-04-03 17:55:59,474] Trial 77 finished with value: 0.7782101167315175 and parameters: {'num_layers': 3, 'num_neurons': 181, 'dropout_rate': 0.6021531294589013, 'lr': 0.0012055569402824387, 'optimizer': 'RMSprop', 'lr_decay': 0.957274943502292, 'activation': 'Sigmoid'}. Best is trial 40 with value: 0.7976653696498055.
[I 2024-04-03 17:55:59,562] Trial 78 pruned. 
[I 2024-04-03 17:55:59,640] Trial 79 pruned. 
[I 2024-04-03 17:56:23,292] Trial 80 finished with value: 0.77431906614786 and parameters: {'num_layers': 2, 'num_neurons': 120, 'dropout_rate': 0.42940554941093567, 'lr': 0.0008904384056583266, 'optimizer': 'RMSprop', 'lr_decay': 0.9861618872891127, 'activation': 'Sigmoid'}. Best is trial 40 with value: 0.7976653696498055.
[I 2024-04-03 17:56:49,655] Trial 81 finished with value: 0.7821011673151751 and parameters: {'num_layers': 3, 'num_neurons': 43, 'dropout_rate': 0.6794589776471947, 'lr': 0.05267339060801098, 'optimizer': 'RMSprop', 'lr_decay': 0.994644116762242, 'activation': 'Sigmoid'}. Best is trial 40 with value: 0.7976653696498055.
[I 2024-04-03 17:57:15,816] Trial 82 finished with value: 0.7821011673151751 and parameters: {'num_layers': 3, 'num_neurons': 34, 'dropout_rate': 0.6200364524531412, 'lr': 0.0837908591438903, 'optimizer': 'RMSprop', 'lr_decay': 0.9931950477935924, 'activation': 'Sigmoid'}. Best is trial 40 with value: 0.7976653696498055.
[I 2024-04-03 17:57:42,562] Trial 83 finished with value: 0.7879377431906615 and parameters: {'num_layers': 3, 'num_neurons': 53, 'dropout_rate': 0.5720335957305827, 'lr': 0.06948958884204418, 'optimizer': 'RMSprop', 'lr_decay': 0.9999235304583328, 'activation': 'Sigmoid'}. Best is trial 40 with value: 0.7976653696498055.
[I 2024-04-03 17:58:13,714] Trial 84 finished with value: 0.7821011673151751 and parameters: {'num_layers': 4, 'num_neurons': 53, 'dropout_rate': 0.5263363322973746, 'lr': 0.00022041338354828198, 'optimizer': 'RMSprop', 'lr_decay': 0.9965525456509735, 'activation': 'Sigmoid'}. Best is trial 40 with value: 0.7976653696498055.
[I 2024-04-03 17:58:36,299] Trial 85 finished with value: 0.7859922178988327 and parameters: {'num_layers': 2, 'num_neurons': 64, 'dropout_rate': 0.5686767591223261, 'lr': 0.028708616687058732, 'optimizer': 'RMSprop', 'lr_decay': 0.9990735934295806, 'activation': 'ReLU'}. Best is trial 40 with value: 0.7976653696498055.
[I 2024-04-03 17:58:59,242] Trial 86 finished with value: 0.7762645914396887 and parameters: {'num_layers': 2, 'num_neurons': 81, 'dropout_rate': 0.5559043825911213, 'lr': 0.061259860808879844, 'optimizer': 'RMSprop', 'lr_decay': 0.9954313888472802, 'activation': 'ReLU'}. Best is trial 40 with value: 0.7976653696498055.
[I 2024-04-03 17:58:59,317] Trial 87 pruned. 
[I 2024-04-03 17:58:59,388] Trial 88 pruned. 
[I 2024-04-03 17:58:59,483] Trial 89 pruned. 
[I 2024-04-03 17:58:59,559] Trial 90 pruned. 
[I 2024-04-03 17:58:59,619] Trial 91 pruned. 
[I 2024-04-03 17:59:31,601] Trial 92 finished with value: 0.7840466926070039 and parameters: {'num_layers': 4, 'num_neurons': 87, 'dropout_rate': 0.5415540914000481, 'lr': 0.012929392273395481, 'optimizer': 'RMSprop', 'lr_decay': 0.9984628583353405, 'activation': 'LeakyReLU'}. Best is trial 40 with value: 0.7976653696498055.
[I 2024-04-03 18:00:03,699] Trial 93 finished with value: 0.7801556420233463 and parameters: {'num_layers': 4, 'num_neurons': 89, 'dropout_rate': 0.5412652725134365, 'lr': 0.013157854335298258, 'optimizer': 'RMSprop', 'lr_decay': 0.9977021685820806, 'activation': 'LeakyReLU'}. Best is trial 40 with value: 0.7976653696498055.
[I 2024-04-03 18:00:36,232] Trial 94 finished with value: 0.7879377431906615 and parameters: {'num_layers': 4, 'num_neurons': 105, 'dropout_rate': 0.5590229112530578, 'lr': 0.09890320821279092, 'optimizer': 'RMSprop', 'lr_decay': 0.9984895096920251, 'activation': 'LeakyReLU'}. Best is trial 40 with value: 0.7976653696498055.
[I 2024-04-03 18:01:08,538] Trial 95 finished with value: 0.7898832684824902 and parameters: {'num_layers': 4, 'num_neurons': 104, 'dropout_rate': 0.1323612465700859, 'lr': 0.044696903733939114, 'optimizer': 'RMSprop', 'lr_decay': 0.9981378355132898, 'activation': 'LeakyReLU'}. Best is trial 40 with value: 0.7976653696498055.
[I 2024-04-03 18:01:40,492] Trial 96 finished with value: 0.7879377431906615 and parameters: {'num_layers': 4, 'num_neurons': 84, 'dropout_rate': 0.5706992212977328, 'lr': 0.09547863935535104, 'optimizer': 'RMSprop', 'lr_decay': 0.9987069438206368, 'activation': 'LeakyReLU'}. Best is trial 40 with value: 0.7976653696498055.
[I 2024-04-03 18:01:40,582] Trial 97 pruned. 
[I 2024-04-03 18:02:11,213] Trial 98 finished with value: 0.7821011673151751 and parameters: {'num_layers': 4, 'num_neurons': 43, 'dropout_rate': 0.5665537133901656, 'lr': 0.09309793300030927, 'optimizer': 'RMSprop', 'lr_decay': 0.9911607430033046, 'activation': 'LeakyReLU'}. Best is trial 40 with value: 0.7976653696498055.
[I 2024-04-03 18:02:11,304] Trial 99 pruned. 
[I 2024-04-03 18:02:11,396] Trial 100 pruned. 
[I 2024-04-03 18:02:43,269] Trial 101 finished with value: 0.7801556420233463 and parameters: {'num_layers': 4, 'num_neurons': 81, 'dropout_rate': 0.566429394415107, 'lr': 0.04374553849095599, 'optimizer': 'RMSprop', 'lr_decay': 0.998524253090861, 'activation': 'LeakyReLU'}. Best is trial 40 with value: 0.7976653696498055.
[I 2024-04-03 18:03:14,885] Trial 102 finished with value: 0.7840466926070039 and parameters: {'num_layers': 4, 'num_neurons': 71, 'dropout_rate': 0.5797367018501459, 'lr': 0.029216020416813905, 'optimizer': 'RMSprop', 'lr_decay': 0.9985003009032454, 'activation': 'LeakyReLU'}. Best is trial 40 with value: 0.7976653696498055.
[I 2024-04-03 18:03:47,265] Trial 103 finished with value: 0.7821011673151751 and parameters: {'num_layers': 4, 'num_neurons': 101, 'dropout_rate': 0.6027619443487815, 'lr': 0.09970583427421334, 'optimizer': 'RMSprop', 'lr_decay': 0.9963097830538212, 'activation': 'LeakyReLU'}. Best is trial 40 with value: 0.7976653696498055.
[I 2024-04-03 18:03:47,355] Trial 104 pruned. 
[I 2024-04-03 18:03:47,448] Trial 105 pruned. 
[I 2024-04-03 18:03:47,539] Trial 106 pruned. 
[I 2024-04-03 18:04:22,102] Trial 107 finished with value: 0.7821011673151751 and parameters: {'num_layers': 5, 'num_neurons': 44, 'dropout_rate': 0.5378016896820825, 'lr': 0.001540070461691258, 'optimizer': 'RMSprop', 'lr_decay': 0.9992179641281379, 'activation': 'ReLU'}. Best is trial 40 with value: 0.7976653696498055.
[I 2024-04-03 18:04:55,572] Trial 108 finished with value: 0.7762645914396887 and parameters: {'num_layers': 4, 'num_neurons': 141, 'dropout_rate': 0.6241774512540951, 'lr': 0.0252075880789703, 'optimizer': 'RMSprop', 'lr_decay': 0.9971832625239859, 'activation': 'LeakyReLU'}. Best is trial 40 with value: 0.7976653696498055.
[I 2024-04-03 18:04:55,662] Trial 109 pruned. 
[I 2024-04-03 18:05:22,690] Trial 110 finished with value: 0.7821011673151751 and parameters: {'num_layers': 4, 'num_neurons': 64, 'dropout_rate': 0.5874303096996893, 'lr': 0.007512827544042027, 'optimizer': 'SGD', 'lr_decay': 0.9838636288059796, 'activation': 'LeakyReLU'}. Best is trial 40 with value: 0.7976653696498055.
[I 2024-04-03 18:05:54,294] Trial 111 finished with value: 0.7859922178988327 and parameters: {'num_layers': 4, 'num_neurons': 74, 'dropout_rate': 0.5718306276337204, 'lr': 0.025964425135863268, 'optimizer': 'RMSprop', 'lr_decay': 0.9985083535138444, 'activation': 'LeakyReLU'}. Best is trial 40 with value: 0.7976653696498055.
[I 2024-04-03 18:05:54,386] Trial 112 pruned. 
[I 2024-04-03 18:06:26,057] Trial 113 finished with value: 0.7801556420233463 and parameters: {'num_layers': 4, 'num_neurons': 74, 'dropout_rate': 0.5279622797786907, 'lr': 0.042740772599677054, 'optimizer': 'RMSprop', 'lr_decay': 0.9951049823492155, 'activation': 'LeakyReLU'}. Best is trial 40 with value: 0.7976653696498055.
[I 2024-04-03 18:06:26,145] Trial 114 pruned. 
[I 2024-04-03 18:06:58,391] Trial 115 finished with value: 0.7821011673151751 and parameters: {'num_layers': 4, 'num_neurons': 89, 'dropout_rate': 0.5968640188525556, 'lr': 0.014460759182291, 'optimizer': 'RMSprop', 'lr_decay': 0.951823141844634, 'activation': 'ReLU'}. Best is trial 40 with value: 0.7976653696498055.
[I 2024-04-03 18:07:30,464] Trial 116 finished with value: 0.7821011673151751 and parameters: {'num_layers': 4, 'num_neurons': 96, 'dropout_rate': 0.6533205345782458, 'lr': 0.00974966137591701, 'optimizer': 'RMSprop', 'lr_decay': 0.9543260984893839, 'activation': 'ReLU'}. Best is trial 40 with value: 0.7976653696498055.
